"id","title","body"
"116728","Visual shader Texture2DParameter default Type ""Data"" results in washed out colors in Mobile/Forward+","Tested versions 4.6.1.stable System information Godot v4.6.1.stable - macOS Sequoia (15.7.4) - Multi-window, 2 monitors - Metal (Mobile) - integrated Apple M2 Pro (Apple8) - Apple M2 Pro (10 threads) - 16.00 GiB memory Issue description In the visual shader editor when adding a Texture2DParameter node this has the default Type set to ""Data"". Using this as is in a sampler to set a shader albedo color works as expected in Compatibility renderer (see below). Image However, if we change to Mobile/Forward+ renderer, this results in very washed out colors: Image I couldn't find any documentation anywhere what this ""Type"" is supposed to be for, but the issue appears to be the ""Data"" type setting. Changing this to ""Color"" instead makes the texture colors correct again on Mobile/Forward+ as well (also works on Compatibility). Image I'm not sure what the Data type is supposed to do, or if this is the expected behavior of it, but at the very least it introduces some hard to figure out lighting/color issues that could easily be avoided by just making Color the default type instead for new Texture2DParameter nodes. And if the issue is caused by this Data type not being supported in either Compatibility or Mobile/Forward+ perhaps a warning should be issued to help users understand why the shader now produces a very different result after switching renderer. Steps to reproduce - Create a new Compatibility mode project - Make a simple 3d scene with a camera, a light and a mesh instance to apply our material to. - Create a new ShaderMaterial and a Visual Shader for this shader material - In the visual shader add a Texture2D sampler connected to the fragment albedo color - In the visual shader add a Texture2DParameter and connect this to the Texture2D sampler (observe that it is default Type:Data) - On the ShaderMaterial resource assign the default icon as the Texture2DParameter texture - Observe the camper preview to see the mesh with the assigned material shows the icon texture as expected. - Switch the project over to Mobile renderer - Observer the material now renders a lot lighter. Minimal reproduction project (MRP) shader_texture.zip"
"116725","Fix drawing tree row rect bug","Fix 116653."
"116724","macOS: Add `nullptr` checks of `script_debugger` in `LayerHost::gui_input`","Maybe fixes 116721. This is a tentative (and arguably crude) fix. Note that this crash could possibly have been fixed in `master` in some other way already, but I have not been able to verify that it actually works, in any branch. However, judging by the information in 116721 it seems likely that it would, if it hasn't been fixed already."
"116722","ARM64 Ardueno Vulkan crash","Tested versions - Reproducible in 4.6.1 System information Windows 11 - Godot 4.6.1.stable - Vulkan (Forward+) - Ardueno (arm64 microsoft surface laptop 7) Issue description Hi, I sometimes develop on my windows surface laptop 7 (arm64). I recently moved to 4.6.1 and eventually tried to develop on laptop. Editor crashes when using Vulkan in Forward+. It doesn't crash with OpenGL (Forward+), D3D12(Forward+) and Vulkan Mobile. Fails here ERR_FAIL_COND_V_MSG(err, PipelineID(), ""vkCreateGraphicsPipelines failed with error "" + itos(err) + "".""); with err = 387965008 Found a shader that causes this issue. Shader's code. It is too large hence the link to pastebin https://pastebin.com/bP9TrnEZ Calling this method more than once makes it fail. Right now it's called only once, but before there were 5 layers. If I add any layer back or just calling apply_mask_layer second time it starts failing when I try to open material with this shader or scene containing this shader. I couldn't reproduce it in brand new project, even though I tried. I made process dump available with debug symbols and can share it through some secure way if development team wants to look at it. it's 1.8 GB ZIP file. Steps to reproduce I couldn't create MRP. For some reason it only reproduces in my original project. But process dump with debug symbols available if dev teams want to give it a try. Minimal reproduction project (MRP) I couldn't create MRP. For some reason it only reproduces in my original project. But process dump with debug symbols available if dev teams want to give it a try."
"116721","macOS: Crash of embedded game also crashed the editor","Tested versions - Reproducible in: Custom fork of 4.6.stable, with a few modifications System information MacBook Pro M1 Max, macOS 15.5 Issue description This issue description will be a bit vague, as I am not able to reproduce this myself, but it seems likely there is (or was?) some issue with the game embedding on macOS, as we had this editor crash reported to us, which happened right as the embedded game itself crashed: Note that this is from a custom fork of 4.6-stable with a few changes here and there, so the line numbers might not perfectly match `master`, but as far as I know none of the more relevant classes here have had any changes done to them. Judging by the call stack and the `KERN_INVALID_ADDRESS at 0x00000000000009d0`, it looks like it's crashing here in `LayerHost::gui_input`, due to `script_debugger` being `nullptr`: https://github.com/godotengine/godot/blob/15a4311583fbaad2eee5d2ecda5437eb9fd68c63/platform/macos/editor/embedded_process_macos.mmL348-L352 My best guess is that `EmbeddedProcessMacOS::set_script_debugger` was called with `nullptr` from `GameView::_detach_script_debugger` after the game process crashed, and at the next flushing of input events it ends up erroneously making its way to this `send_message` call in `LayerHost::gui_input`, but I've tried to simulate this by pushing input events every frame (in both a game and tool context) and manually killing the game process, but it seems to handle it gracefully every time. Steps to reproduce None yet, unfortunately. Minimal reproduction project (MRP) None yet, unfortunately."
"116720","Fix Reinhard and AgX tonemapper in Mobile renderer when using subpass.","- Fixes 116643 When 110077 was merged, 94496 needed to be rebased. During that rebase, one function where the `output_max_value` needed to be set was missed. This caused Reinhard and AgX tonemappers to break with the mobile renderer when using that subpass function."
"116719","`AudioStreamWAV`: Check for `eof_reached` when reading LIST INFO tags","Fixes 116099. Supersedes 116112 which touches code beyond the issue. By analyzing the file, it seems to have a `LIST` chunk that not only is placed after `data` (which is usually the last), but also informs a size of 3,225,026,560 bytes, which is far beyond the end of the file. This is an unusual case, but it can be solved by simply adding an `eof_reached` check that breaks the `INFO` loop (which honestly, should have been there long ago). It will print an error in the editor, but it's reasonable for a file with invalid chunks."
"116718","Remove unnecessary mutex locks in RD & fix a few race conditions.","Removes unnecessary mutex locks from functions where they are not required. I figure most of these are remnants from when `RID_Owner` was not thread safe. I also fixed a few race conditions that I noticed: - Draw list can read framebuffer formats map while it is getting written in a different thread. I don't practically see this happening since framebuffers always get created on the render thread, but it is technically allowed. - Pipeline creation and draw list can read vertex formats map while it is getting written in a different thread. This realistically CAN happen. Eventually I'd like to completely get rid of `_THREAD_SAFE_METHOD_` and use multiple mutexes. This would allow `vertex_array_create`/`index_array_create`/`uniform_set_create` functions to run in parallel and not throttle unrelated rendering functions. However, it is much more complicated than it sounds due to how draw trackers are managed."
"116717","Setters and getters for indexed properties (e.g. AudioStreamInteractive set_clip_name) missing from autocomplete","Tested versions - v4.6.1.stable.flathub [14d19694e] - v4.7.dev1.official [bf95b6258] System information Godot v4.7.dev1 - Freedesktop SDK 24.08 (Flatpak runtime) on Wayland - X11 display driver, Multi-window, 2 monitors - OpenGL 3 (Compatibility) - AMD Radeon 860M Graphics (radeonsi, gfx1152, LLVM 19.1.7, DRM 3.64, 6.17.12-300.fc43.x86_64) - AMD Ryzen AI 7 PRO 350 w/ Radeon 860M (16 threads) - 58.49 GiB memory Issue description Many methods of `AudioStreamInteractive` do not appear in the autocomplete menu in the Script editor. Some methods, such as `get_transition_fade_mode`, do appear, but `get_clip_name`, `get_clip_stream`, `get_clip_auto_advance`, and others do not. These methods do appear in the in-editor documentation. And they can be called without issue. I took a look at the `audio_stream_interactive.cpp` source code to see if I could see anything obvious. I can't but what's striking is that the affected methods are all those for which `bind_method` is called before `ADD_PROPERTY(..., ""clip_count"", ...)`. I can't understand why this would be the case! https://github.com/godotengine/godot/blob/2327a823578a30f09068f97272598521896d5633/modules/interactive_music/audio_stream_interactive.cppL467-L483 Steps to reproduce Minimal reproduction project (MRP) N/A"
"116715","Fix `EditorInspectorArray` insert","Fix 113980."
"116711","GDScript: Fix interrupted coroutines not clearing","* Fixes 79669. * Fixes 84860. * Fixes 116706. * Supersedes 96441. * See also 61003. * Need to make sure this doesn't reintroduce 57126."
"116710","Curve resource became weird after save and restart engine","Tested versions Godot v4.7.dev1 System information Windows 10 (build 19045) - Multi-window, 1 monitor - Direct3D 12 (Forward+) - dedicated NVIDIA GeForce RTX 2080 SUPER (NVIDIA; 32.0.15.6094) - Intel(R) Core(TM) i7-9700K CPU @ 3.60GHz (8 threads) - 31.91 GiB memory Issue description this is my curve edited <img width=""275"" height=""135"" alt=""Image"" src=""https://github.com/user-attachments/assets/afc6bd3a-2728-4aba-a8c0-a3d1c8047da8"" /> this is the curve that after saving and restart engine <img width=""272"" height=""148"" alt=""Image"" src=""https://github.com/user-attachments/assets/00dd38c2-b3b4-47c2-ad2d-3e73cb6b9664"" /> Steps to reproduce 1. create a scene and add a script above 2. edit the curve ,add sevral points(more than 5 points) 3. save the scene 4. restart the engine 5. open the scene and check the curve Minimal reproduction project (MRP) null"
"116706","When an interrupted coroutine is deleted, local objects are not cleared","Tested versions godot 4.X All Version System information windows11 , AMD Ryzen 7900, 48GB , RTX4060ti , DX12,vulkan Issue description https://github.com/godotengine/godot/issues/116649 In the previous link, the example was too complicated, so it seemed that the person in charge misunderstood the problem. Therefore, I simplified it. One thing certain is that if a node is deleted while it is using a coroutine with await, the local objects inside the coroutine are not destroyed (they are not cleared). Steps to reproduce in the main.gd source code, a TestNode is created and then deleted after 5 seconds. In TestNode.gd, the run function is a coroutine running an infinite loop. The problem is that inside this coroutine there is a local variable TestClass. Even though the coroutine is deleted, the memory for this local variable is not released (its destructor is not called). Minimal reproduction project (MRP) coroutine-problem.zip [output] [TestNode] ready [TestNode] tick: 521 [TestNode] tick: 1023 [TestNode] tick: 1526 [TestNode] tick: 2029 [TestNode] tick: 2533 [TestNode] tick: 3035 [TestNode] tick: 3533 [TestNode] tick: 4036 [TestNode] tick: 4539 [TestNode] tick: 5042 [Main] delete test_node [TestNode] exit_tree"
"116704","Editor: Fix inconsistent shader uniform name capitalization","- Fixes https://github.com/godotengine/godot/issues/116251 **Aditional Remaps** Added more remaping options for axis combinations on the EditorPropertyNameProcessor: New remaps: Solved the following: **Updated Material's Group and Sub-Group Naming Convention** On the original issue it was mentioned that the Group and Sub-Group's names for the shader on the Editor's Inspector didn't follow the rest of the Editor's capitalization convention. I pin-pointed the issue to be on material.cpp's _get_property_list(), where the info.name was getting capitalized for both the group and sub-group. This capitalized did not follow the rest of the UI capitalization, as it didn't check the remaping values to capitalize known strings, like in this case the UV. I decided to add to material.cpp `include ""editor/inspector/editor_property_name_processor.h""` so I could use: This way I could follow the capitalization of the rest of the UI and send the info.name to the editor_inspector.cpp update_tree() correctly capitalized before it was built into the UI. The result: <img width=""278"" height=""238"" alt=""image"" src=""https://github.com/user-attachments/assets/aac2e985-a96d-4ebb-9ee3-342659661202"" />"
"116703","Unsaved Scene Causes Inspector Jitter When Changing Mesh Properties","Tested versions - Reproducible in v4.6.1 stable - Not reproducible in v4.5.1 System information Godot v4.6.1.stable - Windows 10 (build 19045) - Multi-window, 1 monitor - Direct3D 12 (Forward+) - dedicated NVIDIA GeForce GTX 1060 3GB (NVIDIA; 32.0.15.8115) - Intel(R) Core(TM) i7-6700 CPU @ 3.40GHz (8 threads) - 31.92 GiB memory Issue description https://github.com/user-attachments/assets/848cb9b5-dbc0-4878-8a0d-8c303f9666c3 As shown in the video, changing the properties of a MeshInstance3D's Mesh is fine at first, but as soon as I create an unsaved scene, the inspector starts jittering up and down every time I change a different property. If you look closely, you can see that this is the specific part of the inspector that's causing the jitter: <img width=""401"" height=""54"" alt=""Image"" src=""https://github.com/user-attachments/assets/3a23e0cd-c79b-42e5-a503-9f357fb9b068"" /> Saving or closing the unsaved scene returns things back to normal. Let me know if I'm leaving out any relevant information. I've never reported a bug before. Steps to reproduce 1. Create a 3D scene, but do not save it 2. Add a MeshInstance3D with a box Mesh. 3. Change different properties of the box mesh. The jitter will stop happening if you keep changing just one property instead of changing different properties. Minimal reproduction project (MRP) N/A"
"116700","Editor oversampling can cause temporary freezes in large 2D scenes after changing zoom level or resizing the viewport","Tested versions (the project engine is 4.6) - Reproducible in: v4.6.1.stable.official [14d19694e] - Not reproducible in: 4.6 stable or older System information Godot v4.6.1.stable - Windows 11 (build 26200) - Multi-window, 1 monitor - Vulkan (Forward+) - dedicated NVIDIA GeForce RTX 4060 Laptop GPU (NVIDIA; 32.0.15.8183) - 13th Gen Intel(R) Core(TM) i7-13620H (16 threads) - 15.70 GiB memory Issue description 4.6 is stable but when i use 4.6.1, redrawing becomes extremly laggy. https://github.com/user-attachments/assets/b00c8c4c-8842-4d57-9dfd-9adf311b1143 performance monitoring ⬇️ https://github.com/user-attachments/assets/1d687c8f-6225-455d-a3f2-5dc4a89a7521 Steps to reproduce - there were all the required files ⬇️ files.zip > NOTE: it only lists all the required files, im not reedited the dependencies. Minimal reproduction project (MRP) mrp.zip scene “stellar” “chunk” “t” are the best slowest and most laggy (all at res://scene/world)"
"116698","Editor: Fix class icons not updating on theme change","Fixes 116697 Salvaged from 105720"
"116697","Some class icons don't update on theme change","Tested versions Tested on 4.6.1-stable and 4.7-dev1 System information Godot v4.6.1.stable - macOS Tahoe (26.3.0) - Multi-window, 2 monitors - Metal (Forward+) - integrated Apple M1 Max (Apple7) - Apple M1 Max (10 threads) - 64.00 GiB memory Issue description When changing editor theme, class icons in certain places do not update, specifically those in editor help pages, scene tabs, and inspector categories. Notably, when changing from a light theme to a dark theme, the light-theme variation still shows (and vice versa), creating poor contrast and readability. Here is an example screenshot taken after changing from a light to a dark theme: <img width=""1608"" height=""1050"" alt=""Image"" src=""https://github.com/user-attachments/assets/68e3e94f-43c0-431f-b9bd-52c3e28a3f24"" /> For reference, this is the expected dark-mode look: <img width=""1608"" height=""1050"" alt=""Image"" src=""https://github.com/user-attachments/assets/3594990d-d7fd-4010-87c2-ae43ef5a5b65"" /> Steps to reproduce - Open a doc page/scene tab/inspector panel that contains a class icon - Change editor theme (eg switch between dark & light theme) Minimal reproduction project (MRP) N/A"
"116696","Fix GLSL shader include","Fixes 80532 by implementing the `Includer` interface from glslang. Note that includes via `ShaderIncludeDB` should not be affected by this PR. I've set an arbitrary depth limit of 1000 to prevent cyclic includes from freezing the engine indefinitely. Should this be something like a project setting instead?"
"116695","Unwrap UV2 on ArrayMesh saved as external resource clears the resource path","Tested versions Reproducible on 4.6.1, 4.6, 4.5.1 System information Ubuntu 24.04, Windows 10 Issue description When you use the Unwrap UV2 for Lightmap/AO function on an ArrayMesh, it clears the resource path. Next time it is saved, it will be embedded in the scene. This means large meshes saved as individual files will get silently pulled into the scene file. Steps to reproduce Make a MeshInstance3D with an ArrayMesh (fastest way is to create a CSGBox3D and bake it) Save it to a `.tres` or `.res` file. Use the 'Unwrap UV2 for Lightmap/AO' tool Observe the resource path is cleared Minimal reproduction project (MRP) N/A, trivial to reproduce from blank project."
"116692","Wayland: Fix race with buffer scaling","Fixes 116679. We now pass the buffer scale along the window size to the display server and set everything from there. This should avoid races where the buffer scale changes while we handle window rect changes."
"116688","Fix error spam when resizing a control in a zero size parent with anc…","When one attempts to resize a `Control` node that is inside a parent where either size axis are 0 while ""anchors mode"" is enabled, the output is spammed with this error: With this PR, it instead ~spams~ shows a toaster telling what is happening, and what to do to stop it."
"116683","Fix wrong rotation of cells while being pasted in the `GridMap` editor","The cells inside the cursor while doing a pasting operation where being rotate incorrectly, despite the rotation being correct once the pasting was actually done."
"116682","Vulkan: Non-emitting GPUParticles3D cause draw call in ""Shadow Render"" pass","Tested versions v4.6.1.stable.official [14d19694e] v4.5.1.stable.mono.official [f62fdbde1] System information Godot v4.6.1.stable - Windows 11 (build 26200) - Single-window, 1 monitor - Vulkan (Forward+) - dedicated NVIDIA GeForce RTX 5070 Ti (NVIDIA; 32.0.15.9174) - Intel(R) Core(TM) i9-9900 CPU @ 3.10GHz (16 threads) - 31.93 GiB memory Issue description Using RenderDoc, I noticed that mesh particles from GPUParticles3D cause draw calls in the shadow pass even though they never emitted. The MRP..: - Has one `GPUParticles3D` with a `BoxMesh` as draw pass 1 and `Amount` set to 200. - The `Emitting` property is turned off. - `ProcessMaterial` does not matter. - There's one `DirectionalLight3D` which has `PSSM 4 Splits` shadows enabled. This causes 4 vkCmdDrawIndexed invokations as seen here: <img width=""222"" height=""340"" alt=""Image"" src=""https://github.com/user-attachments/assets/a84183ed-b7c5-4da5-9be4-8651a123ff83"" /> Notably, there are no such calls for them in ""Render Depth Prepass"" or ""Render Opaque"". **Expected:** There should be no draw calls in any pass, unless the particle system is emitting. Steps to reproduce - RenderDoc (or a similar tool?) is needed to inspect the calls to the vulkan api. - At any time, it shows that the non-emitting particles cause draw calls in the shadow pass only. Minimal reproduction project (MRP) MRP_particles_in_shadow_pass.zip"
"116679","Wayland protocol error due to buffer size not divisible by 2","Tested versions - Reproducible in: 4.6.1 and a3e84cc2af14aa4cffbefd8e13492e59567a64e3 (master at time of writing) - May be reproducible in older versions System information Godot v4.7.dev (a3e84cc2a) - Arch Linux 1 ZEN SMP PREEMPT_DYNAMIC Mon, 09 Feb 2026 17:45:06 +0000 on Wayland - Wayland display driver, Multi-window, 1 monitor - OpenGL 3 (Compatibility) - AMD Radeon 890M Graphics (radeonsi, gfx1150, LLVM 21.1.6, DRM 3.64, 6.18.9-zen1-2-zen) - AMD Ryzen AI 9 HX 370 w/ Radeon 890M (24 threads) - 46.33 GiB memory Issue description Wayland buffers must have a size divisible by their scale. The constraint is being violated intermittently on Sway using a scale=2 output. It appears to be a race condition, where the scale is updated after the correct size has been enqueued (`WindowRectMessage`) but before that message is processed. in that gap the new scale is committed along with an incorrectly sized buffer and Godot crashes with a Wayland protocol error. This commit seems to fix my issue by always using the fractional scaling code path when the viewporter protocol is available. However this doesn't solve the underlying issue, so it could still be hit with compositors that don't support the protocol. Also it's claudeslop, so it could be wrong in other subtle ways. Happy to open a PR with it, or to human-write a better solution with guidance on how to go about that (I'm experienced with Wayland, less so with Godot's windowing code and thread safety model). Here are logs with `WAYLAND_DEBUG=1` and print statements added to `WaylandThread::window_state_update_size()`, `WaylandThread::_frame_wl_callback_on_done()` and `DisplayServerWayland::_update_window_rect()`: Steps to reproduce Use Sway 1.11 with a display scale of 2.0 1. Open project selector 2. Click create project 3. Click browse 4. Esc to exit popup 5. Repeat until crash (usually first try) 6. If no crash, restart Godot and try again Alternative: 1. Open project 2. Open project settings 3. Repeat until crash (usually first try) These may depend on screen size or some other variable Minimal reproduction project (MRP) N/A"
"116678","Fix TextEdit showing focus on some mouse events","Fixes: https://github.com/godotengine/godot/issues/116677 After: Screencast_20260223_190728.webm"
"116677","TextEdit draws focus on right click and dragging text to it","Tested versions 4.7.dev System information Fedora 43 Issue description With gui/common/show_focus_state_on_pointer_event set to never: When you right click on a TextEdit top open context menu it shows the focus state Also happen when dragging text to it https://github.com/user-attachments/assets/52d35558-e2d6-4c89-a6eb-e9ec5acb80e6 Steps to reproduce ^ Minimal reproduction project (MRP) text-edit-focus.zip"
"116676","Check `playback_queue` existance after emit `animation_finished` signal","- Fixes 116674 If the `playback_queue` becomes empty within a `finished` signal (e.g., `stop()` is called there), it should abort because the queue should not be accessed."
"116674","Calling `AnimationPlayer.stop()` on `animation_finished` with queued animation crashes the process","Tested versions - Reproducible in: 4.6.1.stable, 4.7.dev [a3e84cc2af14aa4cffbefd8e13492e59567a64e3] - Not reproducible in: 4.5.1.stable System information Godot v4.7.dev (a3e84cc2a) - Fedora Linux 43 (Forty Three) on Wayland - X11 display driver, Multi-window, 2 monitors - Vulkan (Forward+) - dedicated AMD Radeon RX 9070 XT (RADV GFX1201) - AMD Ryzen 9 9950X3D 16-Core Processor (32 threads) - 60.39 GiB memory Issue description The following script: Will cause the process to crash here: https://github.com/godotengine/godot/blob/a3e84cc2af14aa4cffbefd8e13492e59567a64e3/scene/animation/animation_player.cppL344 ... with the following call stack: ... because the access of `playback_queue.front()->get()` doesn't take into account that the emission of `animation_finished` just above it can clear `playback_queue`: https://github.com/godotengine/godot/blob/a3e84cc2af14aa4cffbefd8e13492e59567a64e3/scene/animation/animation_player.cppL340-L342 This emission of `animation_finished` was added in 112571, so would seem to be cause for this regression. Steps to reproduce 1. Open the MRP 2. Run the main scene 3. Note the crash after the first animation plays Minimal reproduction project (MRP) animation-player-crash.zip"
