"id","title","description","body","ground_truth_id"
"200001","Editor crash on startup using --display-driver wayland","Bug report: tested versions - Godot 4.6.1.stable.gentoo.14d19694e - Godot 4.6.1.stable.official.14d19694e System information Note that I can't get far enough into the editor to get to the Help -> Copy System Info button when launching with wayland, so I just launched with x11 and replaced...","Tested versions - Godot 4.6.1.stable.gentoo.14d19694e - Godot 4.6.1.stable.official.14d19694e System information Note that I can't get far enough into the editor to get to the Help -> Copy System Info button when launching with wayland, so I just launched with x11 and replaced `X11 Display Driver` with `Wayland Display Driver`. If I need to correct that let me know. Here is the backtrace: I've also attached a more complete log of the crash here. Opening a project either from that menu or from `godot --display-driver wayland -e --path /path/to/project` does crash. Godot v4.6.1.stable (14d19694e) - Gentoo 2.18 on Wayland - Wayland display driver, Multi-window, 3 monitors - OpenGL 3 (Compatibility) - AMD Radeon RX 9070 XT (radeonsi, gfx1201, LLVM 20.1.8, DRM 3.64, 6.18.8-gentoo-dist) - AMD Ryzen 9 9950X3D 16-Core Processor (32 threads) - 60.45 GiB memory problem description Whenever I load a project **on KDE Plasma**, it crashes. This bug doesn't occur when I'm on sway. Something weird to note is that I have both swaywm and KDE Plasma installed, and I can only reproduce this bug when using vulkan (forward+ I guess?) in godot **on KDE**. `godot --display-driver wayland -e --path /path/to/project` Minimal reproduction project (MRP) This happens to me for every project so I don't think providing a reference project is necessary. Loading the project selection menu, i.e. just calling `godot` does not crash. Steps to reproduce 1.","116862"
"200002","Editor: Fix Refresh Project Settings UI after reloading from disk","Problem noted: when 'project.godot' is modified externally, the ProjectSettings singleton updates, but the ProjectSettingsEditor window remains stale.","When 'project.godot' is modified externally, the ProjectSettings singleton updates, but the ProjectSettingsEditor window remains stale. This introduces a new editor-only notification (ID: 10001) named NOTIFICATION_PROJECT_SETTINGS_RELOADED to signal UI components like the Input Map and Localization tabs to refresh their views. This Closes 114223","117842"
"200003","[4.5] Fix Metal driver buidl with Xcode 26.4","Bug report: this PR is a manual backport of PR 117819 to the 4.5 branch, because there were conflicts, and there are also conflicts if you try to backport the 4.6 PR 117989 to the 4.5 branch.","Bug report: this PR is a manual backport of PR 117819 to the 4.5 branch, because there were conflicts, and there are also conflicts if you try to backport the 4.6 PR 117989 to the 4.5 branch. This change is required to resolve compiling Godot 4.5 on the latest macOS. This can be further cherry-picked automatically to the 4.4 branch to fix compiling Godot 4.4 on the latest macOS. There is no need to cherry-pick to branhces 4.3 and earlier because those already compile fine.","117990"
"200004","Fix a crahs in the wild with drag and drop in the Skeleton3D editor.","This patch, rather than stating that it can drag nodes, it uses a dedicated type for the drag operation, and validates the arguments before attempting to perform the operation.","This patch, rather than stating that it can drag nodes, it uses a dedicated type for the drag operation, and validates the arguments before attempting to perform the operation. This is a repair for 116669 Additionally, it uses the safer idiom to pass the selected node, as seen in other places in the codebase, where we pass the instance_id rather than the object, and then extract that ou.t Looking for comments on the approach and whether I missed something important. _Bugsquad edited:_ Fixes https://github.com/godotengine/godot/issues/116669","116670"
"200005","Error about unsupported HDR on eidtor start","problem observed: tested versions - Reproducible in 4.7.dev [d2a987599].","Issue observed: tested versions - Reproducible in 4.7.dev [d2a987599]. Minimal reproduction project (MRP) Unnecessary. CC @ArchercatNEO. System information Fedora Kinoite 43 GNU/Linux Issue description At editor startup, this message is always printed: `display/window/hdr/request_hdr_output` is disabled on my project settings. Steps to reproduce Open the editor.","117527"
"200006","Looping back when uploading project","Bug report: bug report: tested versions 4.6.1.stable.official It worked minutes or an hour ago as usual but now it doesn't.","Bug report: bug report: tested versions 4.6.1.stable.official It worked minutes or an hour ago as usual but now it doesn't. I suspect someone just contributed to Godot Web. I'll paste system info into bellow from an empty new project. System information Windows 11 Aspire 3 15 Edge Godot v4.6.1.stable - Web - Single-window, 1 monitor - OpenGL ES 3 (Compatibility) - WebKit WebGL - (2 threads) defect description <img width=""1919"" height=""975"" alt=""Image"" src=""https://github.com/user-attachments/assets/c42896ce-7a6e-4951-8aa8-48ac46c43b75"" /> I upload my zip as normal <img width=""1907"" height=""915"" alt=""Image"" src=""https://github.com/user-attachments/assets/c15e200f-41ba-407e-aae6-616b26b92ca1"" /> Hit install as normal <img width=""1904"" height=""971"" alt=""Image"" src=""https://github.com/user-attachments/assets/1925471f-6796-49c4-96a9-831bee15fc77"" /> Loops back here. Windows 11 Aspire 3 15 Edge 4.6.1.stable.official It worked minutes or an hour ago as usual but now it doesn't. I suspect someone just contributed to Godot Web. I'll paste system info into bellow from an empty new project. Steps to reproduce I don't know what this is, i'm new to github threads, sorry Minimal reproduction project (MRP) It's all godot files","117577"
"200007","Freeze or stop responding when a certain ShaderInclude is involved","Tested versions - Reproducible in 4.6-1 and v4.6.1.stable.official [14d19694e] System information Operating System: Manjaro Linux KDE Plasma Version: 6.5.5 KDE Frameworks Version: 6.23.0 Qt Version: 6.10.2 Kernel Version: 6.18.12-1-MANJARO (64-bit) Graphics Platform: Wayland P...","Tested versions - Reproducible in 4.6-1 and v4.6.1.stable.official [14d19694e] System information Operating System: Manjaro Linux KDE Plasma Version: 6.5.5 KDE Frameworks Version: 6.23.0 Qt Version: 6.10.2 Kernel Version: 6.18.12-1-MANJARO (64-bit) Graphics Platform: Wayland Processors: 24 × AMD Ryzen 9 5900X 12-Core Processor Memory: 128 GiB of RAM (125,7 GiB usable) Graphics Processor: AMD Radeon RX 7900 XT Manufacturer: Gigabyte Technology Co., Ltd. log.txt Steps to reproduce In the MRP, you have a file `fluid.gdshader` which contains `include ""res://texture_animation.gdshaderinc""` - Open `new_shader_material.tres` - Drag & Drop `fluid.gdshader` into the `shader` property of the material - Wait for the freeze or crash to happen Minimal reproduction project (MRP) shaderinclude_mrp.zip The Editor writes approximately 35k lines of errors. Product Name: B550 AORUS ELITE AX V2 defect description When the Editor hits a certain shader+shader include combination, it freezes or crashes.","117627"
"200008","texture_sdf_normal can't be usde in CanvasItem shaders without texture_sdf","Problem noted: tested versions - Reproducible in: v4.6.1.stable.steam [14d19694e] System information OS: Windows 11 - Godot: v4.6.1.stable (Compatibility renderer) - CPU: AMD Ryzen 7 7800X3D - GPU: GeForce RTX 5070 Ti problem description If you want to read the SDF normals gener...","Problem noted: tested versions - Reproducible in: v4.6.1.stable.steam [14d19694e] System information OS: Windows 11 - Godot: v4.6.1.stable (Compatibility renderer) - CPU: AMD Ryzen 7 7800X3D - GPU: GeForce RTX 5070 Ti Issue description If you want to read the SDF normals generated by LightOccluder2D nodes in a shader using texture_sdf_normal(), texture_sdf() needs to be explicitly used in the final shader output. Minimal reproduction project (MRP) sdf-normal-test.zip 2. The node has to be connected to the final output node somehow. Linking the node to the output in any arbitrary way will fix the rendering of both materials. A VisualShader with the VisualShaderNodeTextureSDF disconnected from the output node. Video example: https://www.youtube.com/watch?v=t0yOnlvIcdA Steps to reproduce In the minimal reproduction project I've included 2 shaders which showcase the issue: 1. The problem is that you don't always need the signed distance value returned by the texture_sdf function. A typical shader with texture_sdf() commented out, removing the comment will fix the rendering of both materials. This is a bigger issue for VisualShaders, since having a VisualShaderNodeTextureSDF is not enough. After some testing, it seems like as long as ANY shader performs the texture lookup using texture_sdf(), the shader will work.","117783"
"200009","Fix TextEdit showing focus on some mouse events","Bug report: fixes: https://github.com/godotengine/godot/issues/116677 After: Screencast_20260223_190728.webm","Fixes: https://github.com/godotengine/godot/issues/116677 After: Screencast_20260223_190728.webm","116678"
"200010","Fix audio reimport Causing `Infinite Loop`","Bug report: fix 117817 fix `audio_stream_mp`3 and `audio_stream_ogg` `loop_offset` control","Fix 117817 fix `audio_stream_mp`3 and `audio_stream_ogg` `loop_offset` control","117856"
"200011","Remote Scene tree does not expand to selected node when search query is performed","Tested versions Reproducible in v4.6.1.stable.arch_linux [14d19694e] System information Godot v4.6.1.stable (14d19694e) - Arch Linux 1 SMP PREEMPT_DYNAMIC Mon, 09 Feb 2026 17:16:33 +0000 on Wayland - X11 display driver, Multi-window, 1 monitor - OpenGL 3 (Compatibility) - AMD ...","Tested versions Reproducible in v4.6.1.stable.arch_linux [14d19694e] System information Godot v4.6.1.stable (14d19694e) - Arch Linux 1 SMP PREEMPT_DYNAMIC Mon, 09 Feb 2026 17:16:33 +0000 on Wayland - X11 display driver, Multi-window, 1 monitor - OpenGL 3 (Compatibility) - AMD Radeon 780M Graphics (radeonsi, phoenix, LLVM 21.1.6, DRM 3.64, 6.18.9-arch1-2) - AMD Ryzen 7 8745HS w/ Radeon 780M Graphics (16 threads) - 28.18 GiB memory defect description https://github.com/user-attachments/assets/9a378032-c531-42db-8cca-07fe4da18383 The tree does not expand while using the ""hide filtered out parents"" setting and ""auto expand to selected"" and selecting a node. Oddly enough, searching a node that is just one level beyond a revealed node and selecting it dose work: https://github.com/user-attachments/assets/7985ca72-1068-4d1b-a4a7-bec300cb6654 Steps to reproduce 1. Click the 3 dots next to the scene tree filter and enable ""auto expand to selected"" and ""hide filtered out parents"" 2. Start the game 3. Go to the remote tab 4. Search a node name that is very nested 5. Select the node 6. Clear the search query 7. The node is not revealed Minimal reproduction project (MRP) nested_node_example_2026-02-26_08-59-04.zip","116807"
"200012","Breakpoints disappear while file is saved in external editor","Tested versions Reproducible in - v4.6.stable.mono.official [89cea1439] - v4.6.1.rc1.mono.official [7bfffc846] - v4.7.dev1.official [bf95b6258] System information Godot v4.6.1.rc1.mono - Fedora Linux 43 (KDE Plasma Desktop Edition) on Wayland - X11 display driver, Multi-window...","Tested versions Reproducible in - v4.6.stable.mono.official [89cea1439] - v4.6.1.rc1.mono.official [7bfffc846] - v4.7.dev1.official [bf95b6258] System information Godot v4.6.1.rc1.mono - Fedora Linux 43 (KDE Plasma Desktop Edition) on Wayland - X11 display driver, Multi-window, 1 monitor - Vulkan (Forward+) - dedicated AMD Radeon RX 9060 XT (RADV GFX1200) - AMD Ryzen 7 9700X 8-Core Processor (16 threads) - 30.49 GiB memory problem description I use both Godot and external editor (vscodium, Version: 1.108.10359; Godot Tools version 2.5.1) to edit gdscript files. Add multiple breakpoints to different gdscript files. 2. Save the file in the external editor without any changes (ie. So this doesn't affect only the saved file. vscodium is connected to Godot language server. 3. just press Ctrl-S). Open _any_ gdscript file from the project in an external editor. I have added breakpoints to the gdscript file. It doesn't matter whether I have made any changes to the file. Steps to reproduce 1. Just pressing Ctrl-S without any code changes in the external editor removes _all breakpoints_ from _all files_. Minimal reproduction project (MRP) N/A I would expect the breakpoints not to disappear. When I save the file in the external editor, the breakpoints disappear in Godot editor. --> all breakpoints disappear.","116672"
"200013","Bug report: node Search does not update context menu position if the content is identical","Problem noted: tested versoins - Reproducible in: 4.6.stable (see below for details on 4.5.1) System information Godot v4.6.stable - Ubuntu 24.04.4 LTS 24.04 on X11 - X11 display driver, Multi-window, 2 monitors - OpenGL 3 (Compatibility) - AMD Radeon 760M Graphics (radeonsi, phoenix, LLVM 2...","Tested versoins - Reproducible in: 4.6.stable (see below for details on 4.5.1) System information Godot v4.6.stable - Ubuntu 24.04.4 LTS 24.04 on X11 - X11 display driver, Multi-window, 2 monitors - OpenGL 3 (Compatibility) - AMD Radeon 760M Graphics (radeonsi, phoenix, LLVM 20.1.2, DRM 3.57, 6.8.0-100-generic) - AMD Ryzen 5 7640U w/ Radeon 760M Graphics (12 threads) - 13.45 GiB memory problem description In the node search, the context menu position of the icons on the right (experimental/deprecated) is not updated if you hover over an identical icon on another line. (also affects 4.5.1) There is also a bug where the context menu does not update/hide until the mouse leaves the `Matches` field but I cannot reproduce that one reliably yet. You know you triggered it once the hovered line does not update any more. Probably got something to do with how long you hover, maybe also how many times you triggered the first part above. I seem to get it after a bit if `NavigationLink2D` is selected, then hovering over NavigationRegion2D` and then just moving between the marks. (could not reproduce in 4.5.1, so might be a regression) The issues are reset when you re-open the window. As a side note, would reserving space on the right for the marks be considered? Could open a proposal for that. Steps to reproduce - Search for a Node, e.g. under `Node2D` - `NavigationLink2D`, `NavigationObstacle2D`, `NavigationRegion2D` are listed back to back, all of them are marked as experimental - Hover over a mark, then hover over another one Minimal reproduction project (MRP) N/A","116374"
"200014","Playing audio with AudioStreamPlayer on web by any means other than play() method ignores volume_db and pitch_scale","Tested versions - Reproducible in: - 4.7.dev1, 4.6.1-stable, 4.6-stable (all tests except for play() ignore pitch_scale on web.","Tested versions - Reproducible in: - 4.7.dev1, 4.6.1-stable, 4.6-stable (all tests except for play() ignore pitch_scale on web. - Export to web and play the scene. This includes: - Autoplay - Looping (in the MRP it starts ignoring after 3 loops, but I've seen it ignore after the first loop in other projects with longer sounds) - AnimationPlayer audio track The intended behavior is for the audio to always play with the `volume_db` and `pitch_scale` settings set by the AudioStreamPlayer. This problem can be avoided by changing the `playback_type` on the AudioStreamPlayer to ""Stream"", which is not the default on web. - Set `autoplay` to `true`. https://github.com/user-attachments/assets/8705ab38-af02-469e-a9ab-edabeb0be204 Steps to reproduce Minimal reproduction (autoplay) - Create an AudioStreamPlayer and load a stream. Live demo here: https://files.fupi.cat/fupicat/etc/web-audio-bugs/index.html Tested on both Firefox and Chrome, same issue on both. Minimal reproduction project (MRP) https://github.com/fupicat/web-audio-bugs AnimationPlayer ignores volume_db too) - 4.5.1-stable, 4.4.1-stable (same as above, but AnimationPlayer also ignores volume_db and pitch_scale on desktop) - 4.3-stable (same as above, but AnimationPlayer ignores volume_db and pitch_scale on web, and only pitch_scale on desktop) - Not reproducible in: 4.2.2-stable (before the Playback Type option was implemented) System information Godot v4.6.1.stable - Windows 11 (build 26200) - Multi-window, 1 monitor - OpenGL 3 (Compatibility) - NVIDIA GeForce RTX 3050 Laptop GPU (NVIDIA; 32.0.15.9174) - AMD Ryzen 7 7435HS (16 threads) - 15.82 GiB memory Issue description On a web export, when playing a sound with an AudioStreamPlayer by any means other than directly using the play() method, the audio ignores the `volume_db` and `pitch_scale` properties. I'm aware that the default Sample playback type has some limitations, however, the inconsistencies between Godot versions and ways of playing sound leads me to believe this is a bug rather than intended behavior. This is also not mentioned as a limitation in the documentation.","117022"
"200015","Fix infinite loop in debugger when script has parse error","If using Godot in a way that doesn't support stdin input (e.g.","If using Godot in a way that doesn't support stdin input (e.g. All investigation, testing, and final decisions were made by me with help from the godot contributors chat (https://chat.godotengine.org/channel/new-contributors/thread/rgiMeto2TytKbxksu) Claude was used to help me navigate and understand the codebase. The resolve adds a check before entering the debugger loop in LocalDebugger::debug() that checks the stdin type, if it is not STD_HANDLE_CONSOLE then the error information is printed and the function returns early. The debugger's main loop calls get_stdin_string() which returns empty immediately when there is no interactive console attached, and feof(stdin) never evaluates to true in this scenario, preventing the quit branch from being reached and causing an infinite loop. The interactive debugger still works correctly when launched via the console wrapper. headless mode, or without the console wrapper on Windows), the interactive debugger gets stuck in an infinite loop when the --debug flag is used and a script has a parse defect Fixes 117123 When a parse error occurs during script loading, debug_break_parse() invokes the local interactive debugger. Tested on Windows with and without --headless, with and without the console wrapper executable.","117876"
"200016","Error ""Can't add animation library twice"" when focus AnimationTree sometimes","Bug report: tested versions - Reproducible 4.6.stable - Not reproducible 4.5.satble System information Windows10 Issue description Regarding the AnimationTreeEditor, an error occurs when focusing the AnimationTree to enable the AnimationTreeEditor.","Tested versions - Reproducible 4.6.stable - Not reproducible 4.5.satble System information Windows10 Issue description Regarding the AnimationTreeEditor, an error occurs when focusing the AnimationTree to enable the AnimationTreeEditor. It can be reproduced always when re-select AnimationTreeEditor after AnimationTreeEditor was hidden due to loss of focus triggered by selecting empty in the Scene Tree dock. Steps to reproduce https://github.com/user-attachments/assets/b54a7434-ddda-489d-aeee-03d0f917accc Minimal reproduction project (MRP) nested_tree.zip","116944"
"200017","Text readability bug in 2D Editor Ruler Mode","Tested versions Found in 4.6, already present in 4.5 System information Godot v4.6.stable - Windows 11 (build 26200) - Multi-window, 1 monitor - Vulkan (Mobile) - integrated Intel(R) Arc(TM) 140V GPU (8GB) (Intel Corporation; 32.0.101.8132) - Intel(R) Core(TM) Ultra 7 256V (8 ...","Tested versions Found in 4.6, already present in 4.5 System information Godot v4.6.stable - Windows 11 (build 26200) - Multi-window, 1 monitor - Vulkan (Mobile) - integrated Intel(R) Arc(TM) 140V GPU (8GB) (Intel Corporation; 32.0.101.8132) - Intel(R) Core(TM) Ultra 7 256V (8 threads) - 15.57 GiB memory problem description In the 2D Editor Ruler Mode, I ran into a problem where the measurement text boxes for hypotenuse and long leg overlap and the text is very hard to read. This happens during trying to measure linear distance at low angles relative to y axis - see attached screenshot. Note the overlap of measurement text boxes. <img width=""290"" height=""406"" alt=""Image"" src=""https://github.com/user-attachments/assets/e10eccd0-7cbf-4609-92fd-70de31fdfc3f"" /> Steps to reproduce 1. Select Ruler Mode. Minimal reproduction project (MRP) Not specific to a project. 4. 3. Desired behavior would be to separate the text boxes. 2. Note that when measuring at low angles relative to x axis, the text placement is more reasonable. Open 2D Editor. Try measuring distance at low angles relative to y axis.","117226"
"200018","GPU Particles 2D subemitters not inheriting the parent velocity","Tested versions - Reproducible in: v4.7-dev3; v4.7.dev.gh-113509 [375321054]; v4.7.dev.gh-117909 [499756d28] - Not Reproducible in: v4.7-dev2; v4.6.2-RC1; and earlier versions.","Tested versions - Reproducible in: v4.7-dev3; v4.7.dev.gh-113509 [375321054]; v4.7.dev.gh-117909 [499756d28] - Not Reproducible in: v4.7-dev2; v4.6.2-RC1; and earlier versions. The problem should be somewhere from PR 113509 and earlier, as that was where I noticed it for the first time. Minimal reproduction project (MRP) GPUParticle2D.SubEmitter.Inherit.Velocity.zip - Disabling ""Keep Velocity"" makes the sub-particles fallback to their velocity, as expected. 4) Enable Process Material > Sub Emitter > Keep Velocity. To test with a new project: 1) Create a 2D GPU particle (A) with some velocity or acceleration. System information Godot v4.7.dev3 - Windows 10 (build 19045) - Multi-window, 1 monitor - Vulkan (Forward+, Mobile) - dedicated NVIDIA GeForce GTX 1650 (NVIDIA; 32.0.15.9186) - AMD Ryzen 7 5700X 8-Core Processor (16 threads) - 31.88 GiB memory problem description 2D sub emitter particles are not inheriting the parent's velocity, neither using their own, they just stay in their spawn location. - Re-enabling keeps using their velocity settings instead of using the parent's. I also tested the Artifacts from 117909, but the bug still persists. 5) B should follow A's velocity, but instead keeps it's own or stays in place. 3) Make B a Sub Emitter of A. This issue seem to be a regression, as it happens on v4.7-Dev3, but not on v4.7-Dev2 and earlier. 2) Create a 2D GPU particle (B) with visibly different velocity/acceleration. - Reopening the editor resets the sub-particles to staying in place. Steps to reproduce The reproduction project has the ""main_2d"" scene that shows the issue, even in the editor. I tested with Velocity, Gravity and Accelerations, none worked. Expected behavior The sub-particles should inherit their parent's velocity at the moment they spawn.","117976"
"200019","Godot recreates existing Function wehn connecting Signal from editor","Tested versions - Reproducible in v4.5.1.stable.mono.official [f62fdbde1] System information Windosw 10 , v4.5.1.stable problem description if connecting the signal ""pressed()"" of a Button via the tab ""Node"" in the Editior , a new function is created in the targeted script, ...","Tested versions - Reproducible in v4.5.1.stable.mono.official [f62fdbde1] System information Windosw 10 , v4.5.1.stable problem description When connecting the signal ""pressed()"" of a Button via the tab ""Node"" in the Editior , a new function is created in the targeted script, even if a function of that name is already present. Steps to reproduce create a UI Button, and a script to a scene. Minimal reproduction project (MRP) h <img width=""1269"" height=""608"" alt=""Image"" src=""https://github.com/user-attachments/assets/24d87844-b2e4-48d6-891b-3f8e3aca1943"" /> <img width=""1655"" height=""754"" alt=""Image"" src=""https://github.com/user-attachments/assets/4ce9661f-3c3d-46d7-8093-89544d49cc26"" /> As you can see in the 3rd image, the Connectoin gets removed. <img width=""1829"" height=""717"" alt=""Image"" src=""https://github.com/user-attachments/assets/935128db-b7c2-4945-89cc-9972359347b1"" /> When trying to add a signal with some Parameter, godot creates again a new function, ,throws the error: "" Cannot connect to 'func_name' : the provided callable is not valid "" and removes the connection. This Error has appeared in the Project, while having not been an defect hours before. This makes it completly impossible to connect a signal to a function taking an argument. Declare a function test(i : int) , and try to connect the Signal ""pressed()"" from the Button to said function. Godot then throws the error that a function of that name is already present.","117980"
"200020","Revert ""Expose `Control.call_gui_input`""","Bug report: this reverts commit 35eabf06b9f676b2e4518cca70d825fd91e09b76 / 116405.","Bug report: this reverts commit 35eabf06b9f676b2e4518cca70d825fd91e09b76 / 116405. This was merged by mistake, there's no consensus yet on the implementation.","117869"
