"id","title","body"
"117548","Inner class suggests itself as child","Tested versions - Reproducible in: 4.6.1 System information Godot v4.6.1.stable - Ubuntu 24.04.4 LTS 24.04 on X11 - X11 display driver, Multi-window, 2 monitors - OpenGL 3 (Compatibility) - AMD Radeon 760M Graphics (radeonsi, phoenix, LLVM 20.1.2, DRM 3.57, 6.8.0-106-generic) - AMD Ryzen 5 7640U w/ Radeon 760M Graphics (12 threads) - 13.45 GiB memory Issue description For inner classes, the code editor suggests itself as a child (class). This seems wrong and already raises an error when done on the class itself. When done on a class instance, it only errors at runtime. Edit: See also https://github.com/godotengine/godot/issues/110313 but the `bug` label was removed for some reason. I'm not sure why parent classes share constants with their child classes but at least the false suggestion(s) should be fixed. Steps to reproduce - create a new empty scene and add a script with the code below, see MRP Minimal reproduction project (MRP)"
"117546","Starting a file with a tab followed by any character causes ""Unicode parsing error""","Tested versions Reproducible in v4.6.1.stable.arch_linux [14d1969] and the current master branch: v4.7.dev.custom_build [29d2c7ece] System information Godot v4.6.1.stable (14d1969) - Arch Linux 1 SMP PREEMPT_DYNAMIC Mon, 09 Feb 2026 17:16:33 +0000 on Wayland - Wayland display driver, Single-window, 2 monitors - OpenGL 3 (Compatibility) - AMD Radeon 780M Graphics (radeonsi, phoenix, LLVM 21.1.6, DRM 3.64, 6.18.9-arch1-2) - AMD Ryzen 7 8745HS w/ Radeon 780M Graphics (16 threads) - 28.18 GiB memory Issue description Starting a file with a tab followed by any character causes the console to spam related to https://github.com/godotengine/godot/issues/79806 https://github.com/user-attachments/assets/3d42cf3e-16a7-43b5-853e-8eeada2b1337 Steps to reproduce 1. Create a new gdscript file 2. Make the first line blank 3. Make sure your indentation is set to tabs in the editor settings 4. Press the tab key 5. Type any character, like ""t"" 6. Console gets spammed Minimal reproduction project (MRP) N/A"
"117545","Fix inconsistent tooltip for `@GlobalScope` constants","Closes: https://github.com/godotengine/godot/issues/106944 Related: https://github.com/godotengine/godot/pull/117308 Note: This is split from https://github.com/godotengine/godot/pull/106984, since the original PR became too bloated."
"117544","Fix WAV import failure reporting for corrupt files","Partial Fix for: 117528 - Abort WAV import when the loader returns a null stream (corrupt/invalid files). - Emit a clear error so the import fails visibly instead of looping. maybe it should be applied for every file corrupted, not only wav for now it should patch wav files"
"117543","`Go to Previous Keyframe` shortcut needs to be pressed twice to work","Tested versions - Reproducible in: v4.7.dev System information Godot v4.7.dev (f9a8302c8) - Windows 11 (build 22631) - Multi-window, 3 monitors - Direct3D 12 (Forward+) - dedicated NVIDIA GeForce RTX 3070 (NVIDIA; 32.0.15.8088) - AMD Ryzen 9 7950X 16-Core Processor (32 threads) - 31.15 GiB memory Issue description The Animation editor has an `Alt + Shift + A` shortcut for `Go to Previous Keyframe`. When the timeline's position is at a keyframe, the shortcut doesn't work the first time. We have to press it twice to actually go to the previous keyframe. Steps to reproduce - At any animation with multiple keyframes, place the timeline's position between the second-to-last and last keyframe. - Press `Alt + Shift + A`, it goes to the previous frame. - Press `Alt + Shift + A`, it doesn't work. - Press `Alt + Shift + A` again, now it goes to the previous frame. Minimal reproduction project (MRP) N/A"
"117539","Engine hard crashes completely when zooming out in 3D","Tested versions Tested both in v4.5.1 and v4.6.1 stable versions. System information Godot v4.6.1.stable - Windows 10 (build 19044) - Multi-window, 1 monitor - OpenGL 3 (Compatibility) - NVIDIA GeForce GTX 1650 (NVIDIA; 32.0.15.9579) - Intel(R) Core(TM) i5-10400F CPU @ 2.90GHz (12 threads) - 31.92 GiB memory Issue description The editor runs at high frames, buttery smooth with no lag spikes whatsoever, but if I fly back or zoom out to a certain distance, the editor just completely closes. I opened Godot in --verbose and gathered the following logs at crash: While stripping down a duplicate of my main scene to make an MRP, I found it comes down to one child scene I added. It seems to cause this crash in any new project, so I included the scene on its own in the MRP section. Steps to reproduce - Open included scene below - Zoom out or fly away a certain distance - Crash Minimal reproduction project (MRP) kal.zip"
"117538","Fix incorrect parameter being set in AnimationNodeOneShot","<!-- Please target the `master` branch. We will take care of backporting relevant fixes to older versions. Before submitting, please read our checklist for new contributors: https://contributing.godotengine.org/en/latest/engine/introduction.htmlchecklist-for-new-contributors --> Resolves https://github.com/godotengine/godot/issues/117459"
"117534","TileMap editor: Fix inconsistent Property Names","Fix: 117514 In the TileSet editor, physics layer properties show human-readable labels in Select mode (e.g. ""Linear Velocity""), but Paint mode shows code-style names (e.g. ""linear_velocity"", ""polygon_0_one_way""). This PR updates the Paint UI to use the same human-readable labels for consistency. special thanks to @KrakenByte for complement the code before <img width=""390"" height=""556"" alt=""nonfix"" src=""https://github.com/user-attachments/assets/0b8d6a57-6a69-4b91-9886-29f32b6904a7"" /> fixed <img width=""959"" height=""326"" alt=""2026-03-18_10-43-08"" src=""https://github.com/user-attachments/assets/d40a34a8-dd8f-4f79-8c48-965889b82fdb"" />"
"117533","WebXR does not work with PCVR and Virtual Desktop in Windows 11","Tested versions - Reproducible in all Godot 4 Versions. I tested 4,4, 4,5, 4,6. It never has worked System information Windows 11, Godot 4.6.2.rc1 Issue description If you want to switch to VR the the message ""device context lost"" appears. Steps to reproduce Use Virtual Desktop and any Godot XR program on itch.io from Malcom or Godot XR Tools Demo Minimal reproduction project (MRP) Godot XR Tools Demo"
"117530","Wayland: Only report HDR request failed warning if HDR was actually requested","Fixes 117527 Everything capable of setting HDR on/off assumes that setting it to off won't raise any warns/errors, this check was missing from the Wayland implementation and would always warn if the RenderingDriver didn't support HDR (like OpenGL)."
"117529","Fix hint string parsing for nested dictionaries","Fixes 104259 Helps 107556 Changes the inspector's hint string parsing to only split on the first `;` instead of all instances which caused the nested hint strings to get decimated and not passed down correctly. This allows typed dictionaries to be nested as the value via property list manipulation. For easier to define nested collection support, see 107556 . This would also be fixed with the hint string parsing used in 112632, but I went with the minimal change while the other PR is in review. **Note**: This does not help defining a nested dictionary as a key, only a value. Supporting that kind of hint string would need some kind of grouping syntax to know which `;` belongs to which level of the nesting. This PR is only trying to improve the more common use case. Working nested collections in editor: <img width=""596"" height=""561"" alt=""image"" src=""https://github.com/user-attachments/assets/36b69262-0e09-427a-bd8e-b3ea14c8ba09"" /> <img width=""599"" height=""575"" alt=""image"" src=""https://github.com/user-attachments/assets/83b1359c-2b13-46cc-990f-d8db067c10b9"" /> <!-- Please target the `master` branch. We will take care of backporting relevant fixes to older versions. Before submitting, please read our checklist for new contributors: https://contributing.godotengine.org/en/latest/engine/introduction.htmlchecklist-for-new-contributors -->"
"117528","Import: when file headers/metadata is inaccurate, Godot will freeze infinitely trying to import the file","Tested versions 4.6.1 System information Godot v4.6.1.stable - Windows 10 (build 19044) - Multi-window, 1 monitor - Direct3D 12 (Forward+) - dedicated Intel(R) Iris(R) Xe Graphics (Intel Corporation; 27.20.100.9664) - 11th Gen Intel(R) Core(TM) i7-1165G7 @ 2.80GHz (8 threads) - 39.84 GiB memory Issue description When importing files which have headers (e.g., WAV files), Godot will loop forever trying to import the file if the internal data size is incorrect, while simultaneously blasting the console with things like: I think the proper thing to do here is to simply abort the import if a seek turns out to be invalid. Maybe display an alert dialog to make it quite clear to the user that a file is damaged/broken and as such is not available for use until repaired. An alternative is to repair the file and re-save on disk, but I have no idea how scalable that solution is because Godot supports a lot of import formats and trying to fix every possible problem that we may encounter sounds really difficult (although for all I know it could be easier than I realize). Although I encountered this on audio files, I imagine this could happen with any file format which has offsets or other size indications within it. Steps to reproduce 1. Create a new project or open an existing one. 2. Drop a broken .WAV file into the project directory. (I had about 500 of them, so that probably didn't help...). For broken files, the best way is to generate one and modify one of the chunks to report a size beyond the length of the file. 3. Godot will hang as it tries to import the file forever until forcefully terminated. Minimal reproduction project (MRP) I'm not entirely certain if this requires an MRP or not. It happened with a blank project for me. The most I did was drop a (disabled) add-on into it, but that add-on does not, as far as I know, have format importers. And even if it did, I hadn't enabled it when this happened."
"117527","Error about unsupported HDR on editor start","Tested versions - Reproducible in 4.7.dev [d2a987599]. System information Fedora Kinoite 43 GNU/Linux Issue description At editor startup, this message is always printed: `display/window/hdr/request_hdr_output` is disabled on my project settings. CC @ArchercatNEO. Steps to reproduce Open the editor. Minimal reproduction project (MRP) Unnecessary."
"117521","Fix 3D viewport selection getting stuck when editing a `GridMap`","If you're editing a `GridMap`, and click on an area where no action is done, the viewport will be stuck in the middle of a selection operation."
"117520","RigidBody2D with CCD Ray Cast loses momentum on collision","Tested versions v4.5.1.stable.official [f62fdbde1], v4.6.1.stable.official [14d19694e] System information Godot v4.6.1.stable - Windows 10 (build 19045) - Multi-window, 2 monitors - OpenGL 3 (Compatibility) - Intel(R) UHD Graphics (Intel Corporation; 31.0.101.2137) - Intel(R) Core(TM) i7-10510U CPU @ 1.80GHz (8 threads) - 15.75 GiB memory Issue description RigidBody2D fails to transfer full momentum to another RigidBody2D upon collision when Continuous CD is set to Cast Ray. This issue is not noticeable at all speeds or distances between objects, but in some cases the impulse is reduced by several times. This is very critical for games like billiards or golf. https://github.com/user-attachments/assets/61401d85-bd30-4e5c-b9eb-8d3f6c68c38f Steps to reproduce - Create a 2D scene and add two RigidBody2D nodes, each with a CollisionShape2D (set to CircleShape2D, default radius 10px) - Align both bodies on the same Y-axis and set their X-axis distance to 21 pixels (leaving a 1-pixel gap between their boundaries) - Set Gravity Scale to 0 for both bodies - (Optional) Assign a physics material to both bodies with Bounce set to 1.0 - Set Linear Velocity on the X-axis to 500 (or -500) for one of the bodies (works for 60 physics ticks/sec, e.g. for 120 it works at 1000 px/s) - Duplicate the pair, on the moving body of the second pair, set Continuous CD to Cast Ray - Enable ""Visible Collision Shapes"" in the Debug menu or add sprites to the bodies to visualize the movement - Run the project and compare the velocities of the target bodies after collision in both pairs Minimal reproduction project (MRP) This project contains the exact setup described in the ""Steps to reproduce"" section for immediate testing. ccdRcBug.zip"
"117519","[Arch Linux/Wayland] Vulkan Swap Chain Error causing intermittent stuttering/lag","Tested versions -4.6.1 stable latest master -4.7.dev System information godot ver 4.7.dev Linuxbsd on Arch Linux x86_64, kernel 6.19.8-arch1-1, niri 25.11 wm (Wayland), Intel i7-9700K CPU, NVIDIA GTX 1070 GPU Issue description Have been seeing variations of the following across multiple versions from godot 4.6.1 stable to now the latest master which I compiled locally as v4.7.dev.custom_build.1eb0374e5: `ERROR: Condition ""err != VK_SUCCESS"" is true. Returning: false at: _determine_swap_chain_format (drivers/vulkan/rendering_device_driver_vulkan.cpp:3444) ERROR: Surface did not return any valid formats. at: swap_chain_resize (drivers/vulkan/rendering_device_driver_vulkan.cpp:3705) ERROR: Condition ""err != VK_SUCCESS"" is true. Returning: false` Error was encountered in both forward+ and mobile rendering profiles. Did not seem to occur in compatibility mode. I have also experienced some random crashes which seem related via timing but mostly I've just encountered large frame lag associated with the error message. Occurs intermittently while in the editor or while running. I am in single window mode as I cannot seem to get the game to embed in the editor window even with all the settings checked. I suspect that may be because of my window manager (niri) but unclear. Here is a full log of a single short session launched via my terminal. All I did was fly around in the editor scene view and move the camera a few times: Steps to reproduce Just run the engine with a basic 3d scene with a cube mesh, camera and light. Move the camera or the cube. Minimal reproduction project (MRP) swapchain-error-testproj.zip"
"117515","Make `get_modified_time()` return the maximum value of `ctime` and `mtime` on Unix","Since `mv` and `cp -p` may preserve the `mtime`. And the OS file manager seems to behave in accordance with these behaviors. Files extracted from the same compressed file may have the same timestamp. Therefore, when using these files to overwrite, from the perspective of the path, the `mtime` may not change, even though the content may have changed. See https://github.com/godotengine/godot/issues/117048issuecomment-4064779512. <!-- Please target the `master` branch. We will take care of backporting relevant fixes to older versions. Before submitting, please read our checklist for new contributors: https://contributing.godotengine.org/en/latest/engine/introduction.htmlchecklist-for-new-contributors -->"
"117514","Inconsistent property naming between Select and Paint tabs in TileSet physics layer","Tested versions - Reproducible in v4.6.1.stable.official System information Godot v4.6.1.stable - Windows 11 (build 26200) - Multi-window, 1 monitor - OpenGL 3 (Compatibility) - NVIDIA GeForce GTX 1650 (NVIDIA; 32.0.15.7700) - Intel(R) Core(TM) i3-10105F CPU @ 3.70GHz (8 threads) - 15.85 GiB memory Issue description In the TileSet editor, physics layer properties are displayed differently between Select and Paint tabs. - Select mode uses human-readable labels (e.g. ""Linear Velocity"", ""Angular Velocity"") with tooltips showing code names. - Paint mode displays code names (e.g. ""linear_velocity"", ""polygon_0_one_way""). Select: <img width=""390"" height=""556"" alt=""Image"" src=""https://github.com/user-attachments/assets/b413e3f3-5e44-4fcd-8a25-aab097fe3b01"" /> Paint: <img width=""390"" height=""556"" alt=""Image"" src=""https://github.com/user-attachments/assets/860deae4-3a1c-484b-8179-27fe4be8905c"" /> Steps to reproduce MRP Attached. Minimal reproduction project (MRP) inconsistent-naming-mrp.zip"
"117513","Windows external editor VSCode double-click integration does not work with C#/CSharp.","Tested versions Observed in 4.6.1 System information Win 11 - Godot Engine v4.6.1.stable.mono.official.14d19694e - OpenGL API 3.3.0 NVIDIA 556.19 - Compatibility - Using Device: NVIDIA - NVIDIA GeForce RTX 4060 Laptop GPU Issue description I am using VSCode as my external editor for Godot. I followed the instructions to setup Godot for using an external code editor multiple times exactly. What is not working: edit Cexternally with Double-Click from the ‘File System’ tab. What is working: edit GD scripts externally with Double-Click from the ‘File System’ tab and using the context menu entry ‘Open in External Program’. edit Ccode using the context menu entry ‘Open in External Program’ ` ERROR: Cannot find code editor: Visual Studio Code or VSCodium at: Godot.Error GodotTools.GodotSharpEditor.OpenInExternalEditor(Godot.Script, int, int) (/root/godot/modules/mono/editor/GodotTools/GodotTools/GodotSharpEditor.cs:397) Cbacktrace (most recent call first): [0] void Godot.GD.PushError(string) (/root/godot/modules/mono/glue/GodotSharp/GodotSharp/Core/GD.cs:366) [1] Godot.Error GodotTools.GodotSharpEditor.OpenInExternalEditor(Godot.Script, int, int) (/root/godot/modules/mono/editor/GodotTools/GodotTools/GodotSharpEditor.cs:397) [2] bool GodotTools.GodotSharpEditor.InvokeGodotClassMethod(Godot.NativeInterop.godot_string_name&, Godot.NativeInterop.NativeVariantPtrArgs, Godot.NativeInterop.godot_variant&) (/root/godot/modules/mono/editor/GodotTools/GodotTools/Godot.SourceGenerators/Godot.SourceGenerators.ScriptMethodsGenerator/GodotTools.GodotSharpEditor_ScriptMethods.generated.cs:156) [3] Godot.NativeInterop.godot_bool Godot.Bridge.CSharpInstanceBridge.Call(nint, Godot.NativeInterop.godot_string_name*, Godot.NativeInterop.godot_variant**, int, Godot.NativeInterop.godot_variant_call_error*, Godot.NativeInterop.godot_variant*) (/root/godot/modules/mono/glue/GodotSharp/GodotSharp/Core/Bridge/CSharpInstanceBridge.cs:24) ` Steps to reproduce See Issue description Minimal reproduction project (MRP) N/A"
"117511","Improve thread-safety of `Object` signals","Fixes 117396. > [!NOTE] > I would recommend looking at these changes with whitespace changes hidden, as there's a fair bit of indentation changes. As mentioned in 117396, interacting with signal connections across multiple threads is not currently thread-safe, despite claims to the contrary. `Object::signal_mutex` is mostly covering `this->signal_map`, but does not cover `target->connections` at all. This fixes that by replacing the `OBJ_SIGNAL_LOCK` macro and `_ObjectSignalLock` struct with a new `ObjectSignalLock` struct that optionally takes two objects instead of just one. This lets us lock the `signal_mutex` of both objects at the same time, and (more importantly) in the same order every time. The latter is done by simply ""sorting"" the mutexes by their memory address, since that should be stable for the lifetime of the object. Most of these changes were fairly simple and mechanical in places were we already had the two objects readily available, but a few were less obvious, so are worth elaborating: 1. `Object::~Object` - The scope of the lock when erasing incoming connections has been shrunk to only cover `target->connections`, since we need to lock the `target` mutex. This is technically less thread-safe, since `signal_map` isn't being covered properly, but frankly anything reading/mutating an `Object` currently being destroyed is problematic on so many more levels that this is a non-issue in practice. - There was a null check of `c.callable.get_object()` happening during the erasing of outgoing connections, which will always be `this`, so was removed. 2. `Object::_disconnect` - There was a null check of `slot->cE` happening before, which is already being done inside of `target_object->connections.erase`, so was removed. 3. `Object::emit_signalp` - The scope of the lock has been shrunk to only cover `signal_map` and not the one-shot disconnections. This would otherwise break the lock ordering, since `_disconnect` will internally try to lock both mutexes, but one of them would have (arbitrarily) already been locked. 4. `Object::_remove_user_signal` - Since we can't iterate our signal slots while also doing the double-locking, this method needs to be a two-phase thing. We do this by first (under a `this` lock) finding the `slot_map` of the signal, moving it out into a temporary, then erasing it. Then as a second phase we iterate over our now erased `slot_map` and double-lock as per usual. --- *Disclaimer: AI tooling was used in the planning and review of this change, as well as some minor edits. Any code not physically typed out by myself has been carefully reviewed to the best of my ability.*"
"117510","Embedded windows not redrawn borders after unfocus","Tested versions - Reproducible: 4.6.1-stable (and before too) System information Godot v4.6.1.stable - Fedora Linux 42 (Cinnamon) on X11 - X11 display driver, Multi-window, 2 monitors - OpenGL 3 (Compatibility) - PITCAIRN (radeonsi, , ACO, DRM 2.51, 6.18.7-100.fc42.x86_64) - Intel(R) Core(TM) i7-4770 CPU @ 3.40GHz (8 threads) - 31.27 GiB memory Issue description Losing focus does not trigger redrawing of embedded windows. Windows emit `focus_exited` signal, but are not redrawn. A window is only redrawn if previously focused element was also a window. In example, this is clearly visible in video. I'm using custom theme for windows, where `embedded_border` is a blue panel and `embedded_unfocused_border` is a red panel. https://github.com/user-attachments/assets/c9f4bbcc-f608-49e8-bf50-2847b343ecb0 While I’m clicking on windows, focus works as expected, border redrawn. But when I start clicking outside the windows, borders not redrawn. Steps to reproduce 1. Create two embedded windows. 2. Click on first window. 3. Click outside windows. 4. Click on second windows. 5. Two windows border looks like focused. Minimal reproduction project (MRP) unfocus-window-mrp.zip"
"117509"," Fix resource previews could not be automatically regenerated","<!-- Please target the `master` branch. We will take care of backporting relevant fixes to older versions. Before submitting, please read our checklist for new contributors: https://contributing.godotengine.org/en/latest/engine/introduction.htmlchecklist-for-new-contributors --> Ensure that `EditorResourcePreview::check_for_invalidation()` is called after the cached instance is reloaded: 1. For importable files: after the `resources_reimported` signal is emitted; 2. For other files: after the `resources_reload` signal is emitted; Cache the `callable` within the `cache` of `EditorResourcePreview` to facilitate regenerating the previews for cached resource instances. When generating a preview for a file, simultaneously attempt to regenerate the preview for its cached instance (if a preview has previously been generated). Fix 33745. Fix part of 117048. A complete fix requires using this in conjunction with 117515. This PR: https://github.com/user-attachments/assets/c156164a-1421-47ee-96be-7e1bf4edda32 This PR + 117515: https://github.com/user-attachments/assets/ec220b1e-2d41-41ca-8c3f-53f6185fd4aa"
"117508","Fix blend point setter can't restore the name in deprecated=no","- Fixes https://github.com/godotengine/godot/issues/117490 The cause of the issue is that `name` is always empty in the following line: Ideally, `name` should be the primary key, but since it is more critical that a point cannot be created if `node` is null, we have no choice but to make `node` the primary key. For now, we will keep `node` as the primary key and insert the `itos` name key regardless of whether it is deprecated. If `name` is set, it will be immediately reset right after restoration, so the `itos` name will not be displayed. Conflicts may occur if blend_points without a `name` and blend_points with a `name` coexist within a single BlendSpace, but since such cases never happen normally (unless you edit the .tscn directly), this should not be a problem."
