"id","title","body"
"118043","Security: Add bounds checks to prevent integer underflow in packet size validation","Summary The `on_spawn_receive`, `on_delta_receive`, and `on_sync_receive` functions perform unsigned arithmetic (`p_buffer_len - ofs`) that can underflow if `ofs` exceeds `p_buffer_len`. A malicious client can craft packets that bypass size validation, leading to out-of-bounds memory access. Issue Validation Issue validated via code inspection. Impact A malicious client can send malformed spawn/sync/delta packets that bypass validation checks, potentially causing: - Out-of-bounds memory reads - Server crash (DoS) - Potential information disclosure Reproduction 1. Client connects to Godot multiplayer server 2. Client sends spawn/sync/delta packet with `p_buffer_len` smaller than expected `ofs` offset 3. Arithmetic `p_buffer_len - ofs` underflows to ~4 billion 4. Size checks pass when they should not 5. Subsequent buffer access reads out of bounds Fix Added explicit bounds checks (`ofs > p_buffer_len || ...`) before each unsigned subtraction to ensure the offset never exceeds the buffer length before performing safe arithmetic. Files Changed - `modules/multiplayer/scene_replication_interface.cpp`"
"118041","Fix icons and code completion colors when following system theme","This change fixes the font color and some icons colors in the code completion dropdown menu when the theme is changed due to a change of the system theme. This also fixes 116697 Current behavior: https://github.com/user-attachments/assets/8d831517-5ede-432e-ab07-d055b2f179df With this change: https://github.com/user-attachments/assets/8d0d6be3-0a60-4d0e-ad68-4bf304b044d0 This fix include two changes : One as pointed out here https://github.com/godotengine/godot/issues/116697issuecomment-3960993322 to clear and rebuild the icon cache on system theme change to fix the icon colors. Another change in `CodeTextEditor::_update_text_editor_theme()` to refresh the code completion font colors from the editor settings and resubmit the code completion suggestions with the correct font color if the dropdown is open when the theme change happens. (If the dropdown is not open, the correct font colors are still submitted the next time it is open anyway.)"
"118040","Core: Restore legacy keyboard/mouse device IDs for old projects","Summary Restore device ID 0 for keyboard/mouse events when a legacy compatibility setting is enabled. Motivation Regression in 4.7-dev: keyboard/mouse events now default to device IDs 16/32, which breaks projects that relied on device=0. Fixes 118025. Technical overview - Add a project setting: input_devices/compatibility/legacy_keyboard_mouse_device_ids. - Auto-enable it for projects created before 4.7. - When enabled, normalize keyboard/mouse events to device=0 at input dispatch and in InputMap event storage. - Keep the new IDs as the default for new projects. Testing Not run (code change + unit test update only). AI disclosure This PR description was assisted by an AI tool. Breaking changes None. Default behavior stays the same for new projects."
"118038","External resource references have their UID removed on save if said resources were imported while editor was running","Tested versions - Reproducible in: 4.7.dev [06c3946e3501a7f52a10eed96d200b93df17d373] System information Godot v4.7.dev (06c3946e3) - Fedora Linux 43 (Forty Three) on Wayland - X11 display driver, Single-window, 2 monitors - Vulkan (Forward+) - dedicated AMD Radeon RX 9070 XT (RADV GFX1201) - AMD Ryzen 9 9950X3D 16-Core Processor (32 threads) - 60.39 GiB memory Issue description If you (for example) pull in some changes from Git while the editor is still running, and this change brings with it new files, saving any resource that references these new files (without first restarting the editor) will result in the UID part of these `[ext_resource ...]` references being incorrectly removed. Steps to reproduce 1. Open the MRP project. 2. With the editor still running, do `git checkout e876566`. 3. Note how `main.gd` was added and referenced in `main.tscn`. 4. Save `main.tscn`. 5. Do `git diff`. 6. Note how `uid=""uid://d0pi376alu7e6""` was removed from the newly added `[ext_resource ...]`. 7. Do `git checkout 6bcbc83`. 8. Note how `some_scene.tscn` was added and referenced in `main.tscn`. 9. Save `main.tscn`. 10. Do `git diff`. 11. Note how the UIDs for both references are now removed. Minimal reproduction project (MRP) removed-uid.zip"
"118037","Fix newly imported files not having existing UID assigned","Fixes 109636. Fixes 118038. This change fixes three issues with the `ItemAction::ACTION_FILE_ADD` case in `EditorFileSystem::_update_scan_actions`: 1. It currently does a `ResourceUID::get_id_path` call without checking if the UID actually exists first, causing needless `Unrecognized UID: [...]` errors. - To fix this, I've added a `ResourceUID::has_id` check. 2. It does not currently assign anything to `ia.new_file->uid` for the case where the UID exists on disk but isn't known to `ResourceUID`, which becomes a problem for `ResourceSaver::get_resource_id_for_path` when saving out any file that references this UID, since it relies on whatever is cached in `EditorFileSystemDirectory::files`, leading to the UID part of the reference being erroneously removed. - To fix this, I've added said assignments. 3. It does not currently store the UID in `ResourceUID` for the case where the UID exists on disk but isn't known to `ResourceUID`, which seemed weird/broken. - To fix this, I've added `ResourceUID::set_id`/`ResourceUID::add_id` calls for that case. --- _Disclaimer: AI tooling was used during the triage of these issues._"
"118035","[4.6] Cherry-picks for the 4.6 branch (future 4.6.2) - 5th batch","Fifth and final batch of cherry-picks for 4.6.2, resolving remaining blockers and pain-points that don't require a deep-dive into core"
"118032","GDScript: Fix type deduction for functions without `return` statements","* Fixes 118011. * Resolves 118007. Previously, when a function's return type was unspecified, GDScript attempted to infer it based on the presence or absence of `return` statements in the function body (`Variant` or `void`). However, this is incorrect, since functions can be overridden in child classes, and abstract methods have no bodies at all. I think it's more correct to infer `Variant` in the case of an unspecified return type (or copy the return type from the parent method when overriding). There is one subtle point. If you explicitly specify the `Variant` type (or it's copied from the parent method), you must return some value. However, if the return type isn't specified, you aren't required to return a value. This internal flag (`GDScriptParser::DataType::type_source`) is implicitly copied, but it's not distinguishable in `MethodInfo` reflection and documentation (`Variant` is used regardless of the presence or absence of the flag). However, I don't think we need to distinguish between these two options (118007) - if a method returns a `Variant`, you can always use `return null` in code generation. In my opinion, the only problem is that reflection incorrectly reported the method as `void`. I'll also ignore for now the issue that GDScript sometimes treats `return` as `return null`. This can be somewhat complicated, which we can address later. See also https://github.com/godotengine/godot/pull/79363pullrequestreview-1598144070."
"118031","Make animation editor respect animation step size","Good day! This attempts to fix 34431 where arrow controls on the animation player editor won't move to whole frames. There was a PR for this before https://github.com/godotengine/godot/pull/36918 and @soundgnome agreed that I would translate it to the new engine code."
"118030","Fix SpinBox displayed value rounding","Hello there, this PR fixes 118017 the SpinBox wrongfully using step_decimals to figure out how many decimals to render. Adding Math::count_decimals to core seemed reasonable to me as it has wide utility which is why I diverted from a local fix (contained within SpinBox). (Maybe it can be added to GDScripts @global_scope as well)"
"118029","Incorrect folder name validation","Tested versions - Reproducible in: v4.6.1.stable.official [14d19694e], v4.6.1.stable.mono.official [14d19694e], v4.7.dev3.official [60fff00a6] System information Godot v4.6.1.stable - Windows 11 (build 26200) - Multi-window, 2 monitors - Direct3D 12 (Forward+) - dedicated NVIDIA GeForce RTX 3070 (NVIDIA; 32.0.15.9571) - AMD Ryzen 7 3700X 8-Core Processor (16 threads) - 15.86 GiB memory Issue description The characters \ / * : ? "" < > | are not allowed in path names on Windows. Godot's Create Folder dialog mistakenly says that paths containing ?, "", or < are valid. Steps to reproduce Create a new folder in project. Put ?""< in the name field The dialog now says that the folder name is valid, even though it is not. Pressing OK results in the error ""Could not create folder: Can't create"" Expected behavior: For the OK button the be grayed out and the error message to say that the name contains invalid characters, like when using \, /, *, :, >, or |. Minimal reproduction project (MRP) N/A"
"118025","Recent device ID change for keyboards and mice breaks projects that use `InputEvent.device` directly","Tested versions Reproducible since 4.7 dev 2 System information Godot v4.7.dev (dbff09512) - Windows 11 (build 26100) - Multi-window, 1 monitor - Vulkan (Mobile) - integrated AMD Radeon(TM) Graphics (Advanced Micro Devices, Inc.; 31.0.21923.11000) - AMD Ryzen 5 5500U with Radeon Graphics (12 threads) - 7.33 GiB memory Issue description Recent device ID change for keyboards and mice ( https://github.com/godotengine/godot/pull/116274 ) seems to break some projects that use `InputEvent.device` property directly, see https://github.com/godotengine/godot/pull/116274issuecomment-4148337780 One of the solutions might be to make a project setting for this change to keep compatibility with existing projects. This project setting most likely should be enabled by default for new projects and disabled by default for existing projects. Steps to reproduce Use this piece of code in a script to see the device IDs: Minimal reproduction project (MRP)"
"118020","dedicated_server export with Strip Visuals crashes with SIGSEGV on headless display server","Tested versions - Reproducible in: 4.6.1 System information Godot v4.6.1.stable - Windows 11 (build 26200) - Multi-window, 1 monitor - Direct3D 12 (Forward+) - dedicated NVIDIA GeForce RTX 4090 (NVIDIA; 32.0.15.8157) - AMD Ryzen 9 7950X 16-Core Processor (32 threads) - 63.15 GiB memory Issue description When stripping visuals in an export and then running as a headless server the placeholder .res files that Godot creates for stripped textures cause a segfault somewhere in the engine when instantiating scenes. It seems to be a 4.6 bug, and I've mitigated it for now by skipping those and manually excluding other assets. Steps to reproduce Set up a headless export and turn on dedicated_server stripping. Minimal reproduction project (MRP) N/A"
"118019","Fix `Resource file not found` error during Live-Edit by serializing unsaved resources in-memory","Fix: 117753 Now it checks if the resource actually exists on disk. If it doesn't, instead of failing, it serializes the resource and reconstructs it directly in memory on the remote instance. it should work fine =)"
"118017","SpinBox awkwardly rounds displayed value, specifically showing impossible values when step property is set","Tested versions - Reproducible in 4.6 and 4.7 (2af785641a) - Not tested anywhere else - Issue 18251 mentions a similar problem on 3.0.2 System information Windows 11 & Linux Mint 22.3 Issue description This issue is for a pull request I'm planning. When setting the step of the spin box to something like 0.25 the spin box will round the value for it's display in a misleading manner. Clicking through the values on the spin box will then do the following: When reading the value property directly the result will be the internal value. Just the display gets rounded awkwardly. This is particularly misleading when you rely on the display to be accurate. What I'd expect to happen: The displayed values should be 0, 0.25, 0.5, 0.75, 1 When step size is 0.33 the displayed values should be: 0.33, 0.66, 0.99 (Currently 0.3, 0.7, 1) Steps to reproduce (the MRP conveniently has an interface set up for testing) - Create empty scene - Add SpinBox - Set step to 0.25 - (Optional): Set max_value to 1.0 for easier testing - (Optional): Connect value_changed signal to print value to console - Run scene - Click the arrows, observe how the value is set to 0.25 internally but only displays 0.2 in the spin box Minimal reproduction project (MRP) spin-box-display-issue.zip"
"118014","Fix submenu positioning when `PopupMenu` is spawned near window border","Resolves: https://github.com/godotengine/godot/issues/117994 No AI used. Reverted back positioning logic from search bar PR https://github.com/godotengine/godot/pull/114236."
"118012","Fix option alignment in command line help","The longest option name has changed recently, which led to the option availability flag of `--dump-gdextension-interface-json` being misaligned with all other options. (I just checked and the issue also exists in 4.6.1, so I marked this for cherry-picking.) Preview Before <img width=""1496"" height=""96"" alt=""Screenshot_20260330_190236"" src=""https://github.com/user-attachments/assets/f67d1849-8292-4576-b2a7-b33c1054fbeb"" /> After <img width=""1496"" height=""96"" alt=""Screenshot_20260330_190335"" src=""https://github.com/user-attachments/assets/60c00ce5-b559-4d36-918f-c895abb46bb4"" />"
"118011","@abstract method metadata has incorrect return values","Tested versions Reproducible in Godot 4.5.2, 4.6.1, 4.7 System information Godot v4.7.dev3 - macOS Tahoe (26.3.1) - Multi-window, 2 monitors - Metal (Forward+) - integrated Apple M1 Pro (Apple7) - Apple M1 Pro (10 threads) - 16.00 GiB memory Issue description The results of `get_method_list` contains incorrect return data for abstract methods. The `return.type` and `return.usage` fields are not set correctly. Although this is how the metadata has been historically, due to the changes in return type checks in 4.7 it has become an issue when dynamically generating code. When generating an implementation for the abstract method I must know whether or not I can include `return` clauses. Without correct return metadata I cannot reliably create wrappers. Workarounds It is possible for the user to give my tool information about how to create wrappers, but this has a number of drawbacks. The user could also create a local class that extends the abstract class, but this is tedious. Steps to reproduce Which results in The `return.type` and `return.usage` in all metadata should be the same as the local version in `ExtendsAbstract`. Minimal reproduction project (MRP) See steps to reproduce"
"118006","Web Export: TARGET_NOT_SUPPORTED crash in Android Facebook in-app browser","Tested versions -4.6 stabil System information Android 16 - Samsung S23 Ultra - Godot 4.6 stabil Issue description OS: Android (Tested on Android 16) Browser: Android Facebook In-App Browser (WebView / Chrome 146) Issue description When trying to run a Godot 4 Web Export inside the Android Facebook App's built-in browser, the game crashes at loading. The console throws the following Emscripten-generated error at line 1 in `index.js`: `TARGET_NOT_SUPPORTED;if(currentSafariVersion<150200){throw new Error(""This emscripten-generated code requires Safari v15.2.0 or newer..."")}` **The underlying issue:** The Android Facebook In-App Browser has a very messy User-Agent string that includes both Chrome and Mobile Safari, along with Facebook's custom tags. Example User-Agent Mozilla/5.0 (Linux; Android 16; SM-S918B Build/BP2A.250605.031.A3; wv) AppleWebKit/537.36 (KHTML, like Gecko) Version/4.0 Chrome/146.0.7680.168 Mobile Safari/537.36 [FB_IAB/FB4A;FBAV/554.0.0.57.70;IABMV/1;] Because of this UA string, Emscripten's browser detection gets confused. It detects the word ""Safari"", fails to parse the correct version due to the Facebook tags, assumes it's an outdated Safari version, and throws a fatal exception. **The Proof / Workaround:** The underlying Chromium WebView actually fully supports all required modern features (like Wasm exception handling). **If I manually open the exported `index.js` and delete the `if(currentSafariVersion<150200){...}` check, the game runs perfectly and flawlessly inside the Android Facebook browser!** *(Note: The game also runs perfectly in the iOS Facebook in-app browser out of the box, as the iOS WebKit User-Agent is parsed correctly by Emscripten. The issue is strictly isolated to Android's FB browser UA).* This means we are losing a massive amount of Android mobile players simply due to a false positive browser detection regex in the Emscripten glue code. Steps to reproduce 1. Export any Godot 4.6-stable project to Web. 2. Host it on a server. 3. Post it on Facebook. 4. Open the link on an Android device using the Facebook App. Minimal reproduction project (MRP) N/A - This applies to any blank Godot 4 web export."
"118004","Incorrect error line when using spaces instead of tabs for indentation.","Tested versions - Reproducable: v4.6.1.stable.arch_linux [14d19694e], v4.6.2.rc2.official [638b2f1e9], v4.7.dev3.official [60fff00a6], v4.6.stable.official [89cea1439], v4.5.2.stable.official [6ce3de25a] System information Godot v4.6.1.stable (14d19694e) - Arch Linux 1 SMP PREEMPT_DYNAMIC Thu, 26 Mar 2026 19:20:28 +0000 on Wayland - X11 display driver, Multi-window, 1 monitor - Vulkan (Mobile) - dedicated NVIDIA GeForce RTX 3060 (nvidia; 595.58.03) - AMD Ryzen 5 2600 Six-Core Processor (12 threads) - 31.28 GiB memory Issue description When getting the error ""Used space character for indentation instead of tab as used before in the file."" the line reported in the error is the line above the one that actually has spaces instead of tabs. Shouldn't the error point to the line that has the spaces and not the line above? Because technically the line with the error does not start with spaces. Steps to reproduce 1. Create a new project and a script. 2. Add this code to the script: 3. Observe the error. Minimal reproduction project (MRP) N/A"
"118000","Fix custom categories not having context menu","The category was expected to have documentation to show context menu, so it was not possible to copy/paste values from custom categories (e.g. in TileSet editor). This PR fixes it. <img width=""355"" height=""111"" alt=""image"" src=""https://github.com/user-attachments/assets/1f3aacf3-4992-43e4-8cb0-7a78eba84080"" />"
"117999","DDS: Fix loading 3D textures with mipmaps","3D textures with mipmaps used to be read in the same way as array textures, which caused them to be loaded incorrectly. Sample textures for testing: 3dtexture_test.zip"
"117998","Rework copy-pasting section/category values","Another follow-up to 111469 (is there anything left from the original code? 🤔) Copying section/category values had a major flaw cause by how the properties were copied. The inspector relied on Object's `get_property_list()`, which could return list that does not exactly match what is displayed in the inspector (due to various special cases). The code to extract properties belonging to sections/categories was a bit hacky and reliable. This PR changes it to happen completely on the inspector side. The properties will now register themselves in the parent section/category, so when copying values, they are copied from the list of EditorProperties, instead of object's properties. They are pasted into the EditorProperties too. This allowed to simplify the code (no more special cases for MultiNodeEdit etc.). - Fixes 116889 - Fixes the above bug for shader parameters (idk if there is open issue) - Fixes being able to paste section values into read-only properties - Fixes errors and resetting values when property name is not in clipboard (regression from 117600)"
"117996","Disable auto-translation of plugin names","Prevents auto-translating of plugin name, version and author. Although I wonder if the name should be optionally translateable? It's useful if you include a custom translation in your plugin, but auto-translation is not always desirable if your plugin name happens to be a word that exists in editor translation. The option would need to be stored in the plugin config though."
"117994","PopupMenu Submenu offset is off at the right side of window","Tested versions Reproducible: 4.7dev3 Not reproducible: 4.7dev2 System information W11 Issue description Popup Submenu has the wrong offset when on the right side of the window. Instead of directly left of the parent menu, it's further left. <img width=""713"" height=""756"" alt=""Image"" src=""https://github.com/user-attachments/assets/9e632e70-62bc-42c1-9931-58956fab9e90"" /> Steps to reproduce run the program in mrp right-click inside program to show popup menu at mouse location show popup menu close to the right edge of window for bug Minimal reproduction project (MRP) submenu-mrp.zip"
"117991","GDScript: Fix inconsistent heap-use-after-free on exit","Fixes: https://github.com/godotengine/godot/issues/117975 We can access an already freed script when clearing dependencies between scripts. It can happen because sometimes the reference to the base script can be the last reference and at the same time the next one in the `script_list`. So we first advance list to the next node and then free the script in the `Ref<GDScript> scr` destructor. To fix it I choose to manually clear the base script before moving to the next node to allow it to remove itself from the `script_list` if it needs to. Tbh, not sure how often it happens, but it does happen in my project and in the mrp at least."
"117990","[4.5] Fix Metal driver build with Xcode 26.4","This PR is a manual backport of PR 117819 to the 4.5 branch, because there were conflicts, and there are also conflicts if you try to backport the 4.6 PR 117989 to the 4.5 branch. This change is required to fix compiling Godot 4.5 on the latest macOS. This can be further cherry-picked automatically to the 4.4 branch to fix compiling Godot 4.4 on the latest macOS. There is no need to cherry-pick to branches 4.3 and earlier because those already compile fine."
"117989","[4.6] Fix Metal driver build with Xcode 26.4","This PR is a manual backport of PR 117819 to the 4.6 branch, because there were conflicts. This change is required to fix compiling Godot 4.6 on the latest macOS."
"117988","`Texture2D.draw_rect` rendering at low resolution and with dark outline on HiDPI displays","Tested versions - Reproducible in v4.7.dev [2af785641ae249573f45eb61852d22e0b1a8a03c] - Reproducible in v4.6.1.stable.official [14d19694e] System information Godot v4.7.dev (a761ad537) - macOS Tahoe (26.3.1) - Multi-window, 2 monitors - OpenGL 3 (Compatibility) - Apple M4 Pro - Apple M4 Pro (14 threads) - 24.00 GiB memory Issue description Attempting to draw an SVG texture on a HiDPI display using the `Texture2D.draw_rect()` method gives a blurry result. Here is an example from my code actions PR: <img width=""293"" height=""106"" alt=""Image"" src=""https://github.com/user-attachments/assets/f44bec65-273d-4746-855a-4a48d736e83a"" /> In addition, when the editor is in light mode, there is some strange gray outline around the icon (perhaps due to some antialiasing technique?): <img width=""314"" height=""108"" alt=""Image"" src=""https://github.com/user-attachments/assets/955e2542-2bd2-47e7-8ffe-bf302f67d7dc"" /> Both of these are the result of the following C++ code: with `p_canvas_item` being the output of `TextEdit.get_text_canvas_item()` and `use_color` being the yellow color of the icon. Steps to reproduce Attempt to call the `Texture2D.draw_rect()` method with a small SVG icon on a HiDPI screen. The icon will appear blurry/pixellated. If drawn on a light background, dark artifacts will be visible around the icon. Minimal reproduction project (MRP) The call to `draw_rect()` in my code actions PR is here: https://github.com/Meorge/godot/blob/a761ad5374bc4cf0559039b417be3f25669bfbcb/scene/gui/code_edit.cppL490 I've also attempted to create an MRP using pure GDScript. It renders the same lightbulb icon using several different methods. In the `draw_rect()` method (and related methods), the same resolution and artifact issues can be seen: mrp-draw-texture_2026-03-29_21-02-45.zip"
"117986","Fix color correction not applying in mobile renderer without glow","Fixes 117890 . Problem: color correction wasn't being applied in forward mobile backend unless glow was enabled Cause: ""using_subpass_post_process"" was only disabled when glow, auto exposure, DOF, or canvas background were active. Color correction was missing from this condition, so when only color correction was enabled, the post-process pass was skipped entirely. Fix: Added `environment_get_color_correction_enabled()` to the condition so the post-process pass runs correctly when color correction is active."
