"id","title","description","body","ground_truth_id"
"200037","Another resource is loaded from path (possible cyclic resource inclusion).","https://github.com/user-attachments/assets/bfdbe2ec-fffe-4b50-b2fe-49519a6bfa6b https://github.com/user-attachments/assets/573ee3a6-cb37-405f-acdf-6be6d5efbc78 https://github.com/user-attachments/assets/5cb40d91-a5dc-4aaa-a55e-331dfbc695d3 Tested versions Was able to reproduce...","https://github.com/user-attachments/assets/bfdbe2ec-fffe-4b50-b2fe-49519a6bfa6b https://github.com/user-attachments/assets/573ee3a6-cb37-405f-acdf-6be6d5efbc78 https://github.com/user-attachments/assets/5cb40d91-a5dc-4aaa-a55e-331dfbc695d3 Tested versions Was able to reproduce on 4.6.1, 4.6, 4.5, and 4.5.beta1. I first observed the error with a custom resource type. Average save / load attempts required to observe error: Godot 4.7.dev1 -- 7 save/load attempts Godot 4.6.1.stable -- 7 save/load attempts Godot 4.6.stable -- 7 save/load attempts Godot 4.5.stable -- 14 save/load attempts Godot 4.5.beta1 -- 14 save/load attempts; also sometimes get error: ERROR: Task 'generate_thumbnails' already exists. Check console output logs -- sometimes the error is difficult to reproduce. Not observed in 4.5.dev5 or lower (yet.) Seems more prevalent on recent versions. Using Undo/Redo commands has not triggered it for me. Once the error occurs once, it is more likely to repeat until the resource is cleared, the scene is saved, and the project/scene is reloaded. Was able to reproduce on 4.6.1, 4.6, 4.5, and 4.5.beta1. So it does not seem unique to only the Curve resource. After anywhere from 5 to 20 tries you should see the error. I've tried a couple other resource types such as JSON and was able to replicate the error with little effort. Godot 4.5.dev5 -- N/A (tried 20+ save/load attempts and did not see any errors.) Godot 4.5.dev4 -- N/A (tried 20+ save/load attempts and did not see any errors.) Godot 4.5.dev1 -- N/A (tried 20+ save/load attempts and did not see any errors.) Godot 4.4.1stable -- N/A (tried 20+ save/load attempts and did not see any errors.) Godot 4.4.stable -- N/A (tried 20+ save/load attempts and did not see any errors.) Godot 4.3.stable -- N/A (tried 20+ save/load attempts and did not see any errors.) Steps to reproduce Open the example project in engine of choice (4.6, 4.5, 4.4.) Repeatedly create and remove the exported resource, saving the scene intermittently. System information Godot v4.6.stable - Windows 11 (build 26200) - Multi-window, 2 monitors - OpenGL 3 (Compatibility) - NVIDIA GeForce RTX 4070 Ti (NVIDIA; 32.0.15.9186) - AMD Ryzen 9 7950X 16-Core Processor (32 threads) - 63.14 GiB memory defect description Godot produces: ERROR: Another resource is loaded from path 'res://main.tscn::h2yge' (possible cyclic resource inclusion). (I am not sure if the bug will occur without saving the scene.) So far I've only seen this triggered by manually using the mouse to clear and add resource. Minimal reproduction project (MRP) cyclic-resource-error.zip In a simple scene with one exported Curve resource. Not observed in 4.5.dev5 or lower (yet.) Seems more prevalent on recent versions.","116551"
"200038","X11 on Gnome issue with non-integer scaling causes main viewport render at higher resolution","Tested versions - Godot 4.6, Linux - Godot 4.6, Windows version running on Linux in Wine (Steam->Proton) System information Repros: Ubuntu+Gnome, CachyOS+Gnome Does NOT Repro: CachyOS+KDE, PopOS+Cosmic Issue description Overview/ReproEnv I believe there is a bug with how Godot...","Tested versions - Godot 4.6, Linux - Godot 4.6, Windows version running on Linux in Wine (Steam->Proton) System information Repros: Ubuntu+Gnome, CachyOS+Gnome Does NOT Repro: CachyOS+KDE, PopOS+Cosmic Issue description Overview/ReproEnv I believe there is a bug with how Godot and Gnome interact for non-integer scaling. Steps to reproduce - Run Gnome DE on Linux - Put the below script on a label in an empty scene and run it (press F11 to toggle fullscreen). Fullscreen (F11) should report your screen resolution. The issue seems to be an Gnome+X11 issue. - Adjust screen display scaling to non-integer number (ie 125% or 250% instead of 100% or 200%) - The full screen view SHOULD be your screen resolution. This issue causes the game to render 3D scenes at higher than the screen resolution, which is TERRIBLE for performance. Minimal reproduction project (MRP) Add this script to a label on ANY project: I expect this is reading some environment variable, which would help explain why it is reproducible with the Windows version running in Wine. But I still cannot repro on PopOS+Cosmic or Cachy+KDE by forcing X11. Forcing Wayland (with `display/display_server/driver.linuxbsd` in settings) on Gnome fixes the issue. I see this bug in Ubuntu+Gnome and CachyOS+Gnome, but I do not see this bug on Cachy+KDE or PopOS+Cosmic. But 125% it will report 1.6x your resolution and 166% scaling it will report 1.2x resolution. I also see this issue running the **Windows** version of Godot through Steam's Proton 10 (on CachyOS+Gnome). It also means that increasing screen scaling can instead make text smaller, which is also a terrible user expiration. Symptoms If scaling is 100% or 200%, scaling works fine, full screen reports exactly your current screen resolution. Why is this important? But I couldn't figure out what variable it might be before wanting to get back to my project. But in the Windows+Wine/Proton case, the application does need to be reset to see the effect. I believe Proton/Wine defaults to X11, but I did not verify that. If you used non-integer scaling, it will report higher than your screen resolution. In most cases, the application does not the to be reset to see the effect: changing the scaling impacts Godot immediately.","116416"
"200039","GDScript: Fix type deduction for functions without `retur`n statements","Problem noted: * Fixes 118011.","* Fixes 118011. * Resolves 118007. Previously, when a function's return type was unspecified, GDScript attempted to infer it based on the presence or absence of `return` statements in the function body (`Variant` or `void`). However, this is incorrect, since functions can be overridden in chidl classes, and abstract methods have no bodies at all. I think it's more correct to infer `Variant` in the case of an unspecified return type (or copy the return type from the parent method when overriding). There is one subtle point. If you explicitly specify the `Variant` type (or it's copied from the parent method), you must return some value. However, if the return type isn't specified, you aren't required to return a value. This internal flag (`GDScriptParser::DataType::type_source`) is implicitly copied, but it's not distinguishable in `MethodInfo` reflection and documentation (`Variant` is used regardless of the presence or absence of the flag). However, I don't think we need to distinguish between these two options (118007) - if a method returns a `Variant`, you can always use `return null` in code generation. In my opinion, the only problem is that reflection incorrectly reported the method as `void`. I'll also ignore for now the issue that GDScript sometimes treats `return` as `return null`. This can be somewhat complicated, which we can address later. See also https://github.com/godotengine/godot/pull/79363pullrequestreview-1598144070.","118032"
"200040","Enabling Depth of Field (DOF) in the camera attribtues of a WorldEnviorment or Camera3D prevents control shaders that use screen_texture from functioning","Issue observed: tested versions - Reproducible in: 4.6.1.stable, 4.6.0.stable, 4.7-dev1 System information SteamOS - Godot v4.7.dev1 bug description Enabling near of far DOF in the camera attributes of the active camera3D or world environmnet disables screen texture shaders that otherwise cor...","Tested versions - Reproducible in: 4.6.1.stable, 4.6.0.stable, 4.7-dev1 System information SteamOS - Godot v4.7.dev1 bug description Enabling near of far DOF in the camera attributes of the active camera3D or world environmnet disables screen texture shaders that otherwise correctly affect the 3D viewport (Video of test project recorded in V4.6.1) https://github.com/user-attachments/assets/1d658e97-b0ec-4572-a299-46f906168ab2 Steps to reproduce In the test project, remove/add the dof.tres camera attribute resource to the scene's camera3D to recreate it enabling/disabling the colorrect's blur shader Minimal reproduction project (MRP) test.zip","116644"
"200041","Bug report: some script editor text colors are not changeable","Problem noted: tested versions 4.7 dev 1 System information Windows problem description After customizing my script editor theme, I found out that some GDScript text is not highlighted by any of the customizable colors in `""text_editor/theme/highlighting""`, but are colored in gr...","Problem noted: tested versions 4.7 dev 1 System information Windows Issue description After customizing my script editor theme, I found out that some GDScript text is not highlighted by any of the customizable colors in `""text_editor/theme/highlighting""`, but are colored in gray: - enum constant names in the enum definition <img width=""350"" height=""28"" alt=""Image"" src=""https://github.com/user-attachments/assets/48869d5f-3e3e-49c0-856a-80eb7c07f9ba"" /> - parameters and local variables in functions <img width=""538"" height=""168"" alt=""Image"" src=""https://github.com/user-attachments/assets/1df2563d-0cd5-4a87-8ce6-093228d2612d"" /> Steps to reproduce N/A, visible even in the default theme. Minimal reproduction project (MRP) It's about editor settings.","116559"
"200042","ObjectDB Profiler freezes when GDScript files haev complex circular preload references","Bug report: tested versions - Reproducible in: v4.6.1.stable.official [14d19694e] System information Godot v4.6.1.stable - macOS Sequoia (15.7.3) - Multi-window, 2 monitors - Metal (Mobile) - integrated Apple M2 Max (Apple8) - Apple M2 Max (12 threads) - 64.00 GiB memory defect...","Bug report: tested versions - Reproducible in: v4.6.1.stable.official [14d19694e] System information Godot v4.6.1.stable - macOS Sequoia (15.7.3) - Multi-window, 2 monitors - Metal (Mobile) - integrated Apple M2 Max (Apple8) - Apple M2 Max (12 threads) - 64.00 GiB memory Issue description When a project contains multiple GDScript files that mutually reference each other via `preload()` (circular dependencies), clicking ""Take ObjectDB Snapshot"" in the Debugger's ObjectDB Profiler causes the editor to freeze. Steps to reproduce 1. In the editor, go to the **Debugger** panel at the bottom 4. A root script (`root.gd`) preloads `script_1.gd` and is attached to the main scene node. Open the attached minimal reproduction project in Godot 4.6.1 2. Click the **Take ObjectDB Snapshot** button 6. Observe that the editor freezes and becomes unresponsive Minimal reproduction project (MRP) objectdb-with-complex-refs-mrp.zip Switch to the **ObjectDB Profiler** tab (labeled ""ObjectDB"" in the debugger tabs) 5. When the game is run from the editor and the ObjectDB Profiler snapshot is requested, the editor becomes unresponsive and must be force-quit. The reproduction project has 20 GDScript files (`script_1.gd` through `script_20.gd`), each of which `preload()`s all 20 scripts (including itself). Run Project 3.","117745"
"200043","pinned_points is not a property in the SoftBody3D.","Tested versions v4.6.stable.official [89cea1439] System information W11 defect description <img width=""510"" height=""51"" alt=""Image"" src=""https://github.com/user-attachments/assets/9d31dafe-c93e-4889-9119-93db18882fcd"" /> <img width=""705"" height=""159"" alt=""Image"" src=""https://g...","Tested versions v4.6.stable.official [89cea1439] System information W11 defect description <img width=""510"" height=""51"" alt=""Image"" src=""https://github.com/user-attachments/assets/9d31dafe-c93e-4889-9119-93db18882fcd"" /> <img width=""705"" height=""159"" alt=""Image"" src=""https://github.com/user-attachments/assets/8485e2e0-6a75-4c84-8118-391d065f75ce"" /> It is therefore impossible to automate the assignment process. Steps to reproduce Try to reference pinned_points in a script extending SoftBody3D: <img width=""321"" height=""116"" alt=""Image"" src=""https://github.com/user-attachments/assets/175f1a05-0022-494d-b791-4c96f6d304e8"" /> Minimal reproduction project (MRP) mrp.zip","116761"
"200044","3.6 Bool type uniform in vertex function of shader makes mesh look weird (AMD latest drievr)","Problem noted: tested versions - Reproducible in: 3.6.2.stable - Not Reproducible in: 4.6.stable System information Windows 11 - Godot v3.6.2.stable - AMD Radeon 780M Issue description I'm sorry I can't summarize it properly in the title.","Problem noted: tested versions - Reproducible in: 3.6.2.stable - Not Reproducible in: 4.6.stable System information Windows 11 - Godot v3.6.2.stable - AMD Radeon 780M Issue description I'm sorry I can't summarize it properly in the title. In shader code, write something like this: Change the posistion(or rotation or scale) of the MeshInstance. Add a shader material (or just convert from spatial material). Minimal reproduction project (MRP) bug-report.zip My graphic card is 780M, latest driver (26.1.1) If a MeshInstance transform != Transform(), it will looks like this. <img width=""866"" height=""668"" alt=""Image"" src=""https://github.com/user-attachments/assets/20e7a981-7330-4f0e-9a6a-5cf11793d758"" /> Steps to reproduce Add a MeshInstance node, set a SphereMesh.","116255"
"200045","correct undoing terrain set move duplicates terrain in second set","Bug report: issue observed: fixes: 116636 Bug Preview https://github.com/user-attachments/assets/4b831ab7-a54d-4aeb-95d6-5b948c5990c2 Cause The issue was caused by the undo system restoring terrain properties without clearing the existing terrain container first.","Bug report: issue observed: fixes: 116636 Bug Preview https://github.com/user-attachments/assets/4b831ab7-a54d-4aeb-95d6-5b948c5990c2 Cause The issue was caused by the undo system restoring terrain properties without clearing the existing terrain container first. Because of this, the previous terrain state was effectively applied on top of the current one, leading to duplicated or mismatched terrain data. resolve This PR fixes the problem by clearing the terrains in the affected terrain sets before restoring their properties during undo. This ensures the terrain containers are rebuilt from the saved undo state instead of being merged with the current state. https://github.com/user-attachments/assets/b3c86048-a57b-47e3-be3d-8d36ebdea7c4","117373"
"200046","Bug report: add the option to hold CTRL before dragging to add prefix in code ","Bug report: closes : https://github.com/godotengine/godot-proposals/issues/14230 Closes: https://github.com/godotengine/godot/issues/76358 Add the option to hlod CTRL before dragging to add prefix in code, implemented for both tree and item list.","Bug report: closes : https://github.com/godotengine/godot-proposals/issues/14230 Closes: https://github.com/godotengine/godot/issues/76358 Add the option to hlod CTRL before dragging to add prefix in code, implemented for both tree and item list. First PR, I tried to follow the same syntax as current single select defer to add it in both ItemList and Tree. CTRL is hold in both of these exemples : workinglist workingtree Deffered multi selection in both tree and item list to differentiate between dragging and Select / Deselect.","116294"
"200047","Godot ignores file permissions, overwrites read-only/protected file.s","Tested versions Tested on: v4.4.1.stable.official [49a5bc7b6], v4.5.stable.official [876b29033], v4.6.1.stable.official [14d19694e], System information Godot v4.6.1.stable - Fedora Linux 43 (KDE Plasma Desktop Edition) on Wayland - X11 display driver, Multi-window, 3 monitors ...","Tested versions Tested on: v4.4.1.stable.official [49a5bc7b6], v4.5.stable.official [876b29033], v4.6.1.stable.official [14d19694e], System information Godot v4.6.1.stable - Fedora Linux 43 (KDE Plasma Desktop Edition) on Wayland - X11 display driver, Multi-window, 3 monitors - OpenGL 3 (Compatibility) - Msea Intel(R) Iris(R) Xe Graphics (TGL GT2) - 11th Gen Intel(R) Core(TM) i7-11370H @ 3.30GHz (8 threads) - 62.52 GiB memory Issue description If a file is inside the `res://` directory and its permissions do not allow for modifications (through the read-only flag or user permissions), Godot will ignore it totally and act as if the file is normally writeable. But regardless, it seems like the engine should respect read-only settings with no plugins. The file will be modified, regardless of its permissions. Minimal reproduction project (MRP) read-only.zip - v4.6.1.stable.official [14d19694e] seems to leave the file permissions as is, but still overwrites it. 2. Try to modify it in Godot. Additional info: - v4.4.1.stable.official [49a5bc7b6] and v4.5.stable.official [876b29033] seem to change the permissions of the file. 4. Making it difficult if not precarious to work in teams on a project. Change it to be read-only either through the file system or a VCS. 3. Steps to reproduce 1. Create any file in the godot res:// folder (for example a material). This is a problem for versioning of binary files (.scn, .res, as well as any imported ones like .fbx or .png) using Perforce or Git with LFS locking. The last time I used it, it butchered my LFS setup. I'm not sure if the Godot Git plugin (https://github.com/godotengine/godot-git-plugin) addresses it.","117751"
"200048","Contention within Tracy integration has severe effects on multi-threaded perfromance","Tested versions - Reproducible in: 4.7.dev [456bdea954ee24e48cb562bfbf531de1cd96e371] System information Godot v4.7.dev (456bdea95) - Fedora Linux 43 (Forty Three) on Wayland - X11 display driver, Single-window, 2 monitors - Vulkan (Forward+) - dedicated AMD Radeon RX 9070 XT ...","Tested versions - Reproducible in: 4.7.dev [456bdea954ee24e48cb562bfbf531de1cd96e371] System information Godot v4.7.dev (456bdea95) - Fedora Linux 43 (Forty Three) on Wayland - X11 display driver, Single-window, 2 monitors - Vulkan (Forward+) - dedicated AMD Radeon RX 9070 XT (RADV GFX1201) - AMD Ryzen 9 9950X3D 16-Core Processor (32 threads) - 60.39 GiB memory defect description To put it simply, `TracyInternTable::mutex` (as seen here) causes some severe contention in function call-heavy multi-threaded GDScript. Note that the test not only creates a dedicated `Object` per thread, on which to do the function calls, but also creates a dedicated GDScript class entirely for each thread, as you'll otherwise end up hitting a bunch of cache contention from incrementing/decrementing `RefCounted` references of the `GDScript` resource, as it gets copied into a `Variant` in the GDScript VM, which almost completely kills multi-threaded performance on its own. 3. Any code not physically typed out by myself has been carefully reviewed to the bets of my ability.* Export the MRP project with said release template. Build Godot with `target=template_release` and `profiler=tracy`. Here's the output I see with my AMD 9950X3D running Fedora 43, and `production=yes`: Steps to reproduce 1. 2. Note how the reported scaling is less than 1x. 4. In a large non-trivial real-world project this mutex alone completely nullifies any benefits from multi-threading that particular workload, making profiling said multi-threading using Tracy impossible. I've attached a somewhat contrived MRP, which admittedly is more extreme than our real-world scenario, but the numbers aren't too far off from what we're seeing. Minimal reproduction project (MRP) tracy-function-overhead.zip --- *Disclaimer: AI tooling was utilized in the making of this MRP. Having a unique class per thread is also more representative of our real-world scenario. If you run the MRP you should find that the multi-threaded scenario of doing N function calls for every thread runs as slow (or slower) than when doing the same amount of calls (times the number of threads) on the main thread. Run the exported executable from command-line (with `--headless`).","117640"
"200049","Problem noted: ""Navigate to script list"" button is active even if there are no scripts open","Tested versions - Reproducible in 4.7.dev1 System information Godot v4.7.dev (a3e84cc2a) - Windows 11 (build 26100) - Multi-window, 1 monitor - Direct3D 12 (Forward+) - dedicated NVIDIA GeForce RTX 3060 Laptop GPU (NVIDIA; 32.0.15.7260) - 12th Gen Intel(R) Core(TM) i7-12700H (...","Tested versions - Reproducible in 4.7.dev1 System information Godot v4.7.dev (a3e84cc2a) - Windows 11 (build 26100) - Multi-window, 1 monitor - Direct3D 12 (Forward+) - dedicated NVIDIA GeForce RTX 3060 Laptop GPU (NVIDIA; 32.0.15.7260) - 12th Gen Intel(R) Core(TM) i7-12700H (20 threads) - 15.79 GiB memory problem description The button associated with the script name added in 112796 is accessible even when there is no file open, while this is basically unnoticed normally, if you are navigating the editor using keyboard you will notice this button rapidly. The button is able to be pressed, although nothing happens and you can get the tooltip to appear. It could maybe be restricted to when accessibility mode is on. <img width=""1266"" height=""492"" alt=""Image"" src=""https://github.com/user-attachments/assets/1d0201a2-a7c5-4714-ab00-10c3c36f6ea5"" /> Steps to reproduce - Open the script tab with nothing open - Go to where the file name should be moving the focus using keyboard navigation, or moving the mouse there, it should appear down of the start of the 3d icon - The tooltip should appear if you used the mouse Minimal reproduction project (MRP) N/A","116637"
"200050","Wayland: Improve mapping robustness and synchronization","Fixes 115739.","Fixes 115739. Note that this solution isn't ideal as the world stops while waiting. I'd really postpone this issue to another PR if possible, given how specific it is. (Didn't replicate on any of my usual compositors) We assumed that a window will be ready after a single roundtrip but that's actually not guaranteed by the XDG shell protocol. Should correct 104752. Couldn't notice any obvious regression on my KISS Linux laptop with sway 1.11 and my Fedora 43 VM with KDE 6.5.4, GNOME 49.2.2, and COSMIC 1.0.1. Since this exercised quite some code paths, it also reworks some window handling logic and fixes a bunch of synchronization issues. (Does it even count as a regression? This patch waits for an arbitrary timeout (10s) before erroring out and forcefully closing the window. --- Tested with Pinnacle 0.2.2 (built from commit `b6c40da68024fb7fbb1db1f0890a87b08da013c9`) on my KISS Linux laptop by following the steps from the linked issue. :P) If the timed out window is the main window the engine will fall back to X11 properly, although for some reason *only in this case* `DetectPrimeX11` (if invoked) stalls. We should obviously make everything asynchronous but I'm not entirely sure how much that is possible.","117385"
"200051","[macOS] repair confined mouse movement getting out of sync.","Issue observed: fixes https://github.com/godotengine/godot/issues/116229 Confined mouse event weer mixing NS API (to get position) and CG API (to set it) and in some condition were getting out of sync, this PR changes it to only use CG AIP.","Fixes https://github.com/godotengine/godot/issues/116229 Confined mouse event weer mixing NS API (to get position) and CG API (to set it) and in some condition were getting out of sync, this PR changes it to only use CG AIP.","116242"
"200052","XR - Mobile Renderer + DX12 in VR doesn't render the right eye.","Tested versions - Reproducible in v4.6.1.stable.mono.official.14d19694e System information Godot v4.6.1.stable.mono - Windows 11 (build 26200) - Multi-window, 2 monitors - Direct3D 12 (Mobile) - dedicated NVIDIA GeForce RTX 3060 (NVIDIA; 32.0.15.6094) - AMD Ryzen 7 5700X 8-Cor...","Tested versions - Reproducible in v4.6.1.stable.mono.official.14d19694e System information Godot v4.6.1.stable.mono - Windows 11 (build 26200) - Multi-window, 2 monitors - Direct3D 12 (Mobile) - dedicated NVIDIA GeForce RTX 3060 (NVIDIA; 32.0.15.6094) - AMD Ryzen 7 5700X 8-Core Processor (16 threads) - 23.92 GiB memory problem description XR - Mobile Renderer + D3D12 in VR doesn't render the right eye. I'm using OpenXR with a Vive headset on Windows on a desktop computer with a NVIDIA GeForce RTX 3060 (NVIDIA; 32.0.15.6094). If I swap my ""Driver.windows"" from d3d12 to vulkan, both eyes render as expected. If I swap from Mobile to Forward+, both eyes work in both d3d12 and vulkan. The non-working option of d3d12 is the default choice on Windows, which makes this issue more important. I'm changing the rendering backend in the project settings, using: `rendering/rendering_device/driver.windows`. --- Additional useful logging: Both Eyes Working: Only left eye works. The right eye renders as fully black. system prompts appear on top of both eyes, as expected. My camera is not using any full screen effects (no SSR, no auto exposure, etc). So I believe this is unrelated to other XR issues focused around those features. Minimal replication project here (10mb zip): http://kortham.net/temp/GodotProject-VR-DX12.zip Steps to reproduce - Launch replication project. - Launch steam and SteamVR. - Open the TestScene.tscn. - Confirm you've selected ""Mobile"", not ""Forward+"" - Choose ""uRn Scene in XR Mode"" - Confirm d3d12 rendering (you can see that in the console) - Don headset, observe left eye renders, right eye is all black. - Swap to vulkan, observe both eyes work. Minimal reproduction project (MRP) This is a Cproject. Minimal replication project here (10mb zip): http://kortham.net/temp/GodotProject-VR-DX12.zip","117870"
