"id","title","body"
"117090","Skeleton2D nodes with a non-empty modification_stack cannot be instantiated multiple times in the same scene","Tested versions v4.6.1.stable.mono.official.14d19694e System information Winwos11 - Godot v4.6.1.stable.mono.official.14d19694e - Vulkan 1.4.312 (Forward+) - NVIDIA GeForce RTX 3060 Laptop GPU Issue description When a scene containing a Skeleton2D child node, whose Skeleton2D node's modification_stack property is not empty, is instantiated multiple times in other scenes, a large number of duplicate error messages will be output, all stating ""ERROR: Drawing is only allowed inside this node's _draw(), functions connected to its draw signal, or when it receives NOTIFICATION_DRAW."" At this time, the editor becomes abnormally laggy, the 2D skeletal animation exhibits many anomalies, and sometimes the editor even crashes directly and becomes unresponsive. <img width=""2559"" height=""1522"" alt=""Image"" src=""https://github.com/user-attachments/assets/ea002a21-5468-4817-b41f-df799c47015b"" /> But if you set the `resource_local_to_scene` property of the SkeletonModificationStack2D resource to true, this problem will not occur. Steps to reproduce 1. **Create a Skeleton2D scene** - Create a new scene with a Node2D as root - Add a Skeleton2D node as child - Add a SkeletonModificationStack2D resource to the Skeleton2D node's `modification_stack` property - Add at least one modification (e.g., SkeletonModification2DLookAt) - Save this scene as `skeleton_scene.tscn` 2. **Create a test scene** - Create a new scene with a Node2D as root - Instance `skeleton_scene.tscn` multiple times (at least 2-3 instances) as children 3. **Reproduce the issue** - Run the test scene - Observe the console output - The following error will spam repeatedly: - The editor will become extremely laggy - 2D skeletal animations will display abnormally - In severe cases, the editor may crash or become unresponsive 4. **Expected behavior:** - No error messages - Smooth editor performance - Normal skeletal animation display 5. **Actual behavior:** - Multiple instances of the same scene cause continuous error spam - Editor performance degrades significantly - Skeletal animations fail to render correctly - Editor may crash when multiple instances are active - Setting `resource_local_to_scene = true` on the SkeletonModificationStack2D resource resolves the issue Minimal reproduction project (MRP) Test4.6.zip"
"117088","Add `fix_alpha_border` and `premult_alpha` to the `DPITexture` importer.","Fixes https://github.com/godotengine/godot/issues/117082"
"117084","Profiler: Fix for graph disappears when user stops and starts profiler while zoomed in","This is a bug where the user pauses the profiler and zooms into the graph. They then stop the profiler and restart it. Because the zoom did not get reset the user sees no profiler graph and thinks it's not working. Is it in fact working but the graph is way to the left because of the previous zoom state. Another way to reproduce this bug. Start profiling, zoom in to a section of the graph way to the right, press the ""Clear"" button in the profiler. The graph will disappear. This confuses the user who see an empty graph and thinks it's not working. It is working, it's just all the way to the left where they can't see it because of the zoom. This PR fixes the issue by moving (resetting the variable) the graph to where the user can see it. 1 line of code added to 1 file. That 1 line sets 1 variable to it's original initialized state when the user clears the data from the profiler graph. With this fix the user will no longer think the profiler graph is broken when they stop and start (or Clear) it while zoomed in. ******************************* Disclosure and License -As a software engineer I use many systems to ensure code quality, and that includes AI. I use the AI to: do detailed code analysis, be a sounding board for my different ideas, look for bugs, find unexpected behaviors, identify performance hot spots, expensive CPU calls, race conditions, poorly placed variable initializations, possible optimizations, and many more things. I do this during development and before I push code to the repo. It lists items that are potential problems and I decide what I think is important and make those changes. -For a descriptive example of my AI usage on a particular PR please read this https://github.com/godotengine/godot/pull/117066issuecomment-4061773098 -Any and all code attached to this PR falls under the coverage of the MIT License."
"117083","Profiler: Fix for graph stopping when excessive zooming consumes the CPU","This is a bug where the user can overload the CPU and the profiler by continuous zooming in or out. The Godot editor app will slow way down and the profiler graph will stop updating. It looks like everything is stuck to the user. The issue was that the zoom was causing a re-draw of the profiler graph very quickly even if the graph was already at max zoom or min zoom. 8 line code change in 1 file. The new code stops the graph re-drawing after you have reached the min or max zoom. The Godot editor app will no longer temporary lock up. ******************************* Disclosure and License -As a software engineer I use many systems to ensure code quality, and that includes AI. I use the AI to: do detailed code analysis, be a sounding board for my different ideas, look for bugs, find unexpected behaviors, identify performance hot spots, expensive CPU calls, race conditions, poorly placed variable initializations, possible optimizations, and many more things. I do this during development and before I push code to the repo. It lists items that are potential problems and I decide what I think is important and make those changes. -For a descriptive example of my AI usage on a particular PR please read this https://github.com/godotengine/godot/pull/117066issuecomment-4061773098 -Any and all code attached to this PR falls under the coverage of the MIT License."
"117082","`DPITexture` has incorrect alpha borders","Tested versions - Reproducible in v4.7.dev2.official [778cf54da] System information Godot v4.7.dev2 - Windows 10 (build 19045) - Multi-window, 3 monitors - Vulkan (Forward+) - dedicated NVIDIA GeForce GTX 1070 Ti (NVIDIA; 32.0.15.8228) - AMD Ryzen 5 1500X Quad-Core Processor (8 threads) - 15.92 GiB memory Issue description ""DPITexture"" import does not have the ""Fix Alpha Border"" option, which means that in many circumstances it'll make these outlines (left). <img width=""1358"" height=""664"" alt=""Image"" src=""https://github.com/user-attachments/assets/bf7dcc04-c420-418a-a742-ae957a5313e1"" /> The ""Texture2D"" import (right) doesn't have this problem as it has ""Fix Alpha Border"" enabled by default. By manually disabling it you can get results that are practically identical in some circumstances. I deliberated for a while over whether this was technically a proposal but I eventually decided that it felt unintended, since ""Fix Alpha Border"" usually defaults to being enabled. Steps to reproduce 1. Import a `DPITexture` (with non-black borders), and place it onto a `Sprite2D`. - To better see the issue, place it on a background of a similar color (e.g. a `ColorRect` or even a copy of the same `Sprite2D`). 2. Adjust the `Sprite2D` in a way that it doesn't perfectly snap to the viewport. It's easiest to either: a. Zoom the editor viewport such that it is not a perfect multiple of the default b. Adjust the position, offset, rotation, or scale with non-integer values 3. There should be a fairly clearly visible black border. Minimal reproduction project (MRP) issue.zip"
"117081","Inferred return values are breaking existing code","Tested versions - Reproducible in 4.7.dev2 System information Godot v4.7.dev2 - macOS Tahoe (26.3.0) - Multi-window, 2 monitors - Metal (Forward+) - integrated Apple M1 Pro (Apple7) - Apple M1 Pro (10 threads) - 16.00 GiB memory Issue description It appears that Godot is assuming the return types of functions that do not have a return type specified. This is causing a lot of `Cannot return value of type ""X"" because the function return type is ""Y""` errors in my plugin (GUT). I turned all ""Error"" to ""Ignore"" and the issue still happens. One simple example is I have a method that the user is expected to override if they want to make GUT skip a test script while running tests. GUT will skip the script if the user returns `true` or a `String`. All other values returned are treated as `false`. The `String` is displayed in the logs if it is returned. Here are two example implementations given in the wiki: In the editor it marks the string return as an error because it thinks that the return value is a `bool`. <img width=""609"" height=""222"" alt=""Image"" src=""https://github.com/user-attachments/assets/b86c5c1c-d9a0-4bfc-a409-71f145e3c7f2"" /> There are zero declarations of `should_skip_script` in the GUT project that have a declared return type. I attempted to declare a return type of `Variant`, but that causes parsing errors on the `DisplayServer` example, since not all paths return a value. This would be a feasible workaround, but it isn't a great solution. There could be many users that are using this example in CICD pipelines. This also appears to be affecting my dynamic Script doubling logic as there are many tests failing due to `Cannot return value of type ...` errors, or `A void function cannot return a value.` errors. I have not looked in that yet though, since the above case is way less complicated. I imagine it has to do with the fact that return types weren't supplied in the metadata, so all my wrappers `return super()` by default. Steps to reproduce Successful reproduction * clone https://github.com/bitwes/Gut * Open the editor * Click the ""GUT"" bottom panel * Click ""Run All"" Failed to reproduce I was unable to reproduce the issue with a simple project that had two inner classes in the same file that replicated the definitions of `should_skip_script`. I was also unable to replicate it with two files with `class_name` that replicated the definitions of `should_skip_script`. Minimal reproduction project (MRP) clone https://github.com/bitwes/Gut"
"117080","Fix corner cases related to scroll hints across the editor","- Change the `update_layout()` function to also pass the slot, still compatible with the solo argument one. This is necessary for some of the changes below. - Make the center bottom dock share the same border size as other docks. - Adjust scroll hints of some docks when placing them in the lower bottom slots. - Add scroll hints to the OpenXR Action Map editor. - Fix wrong theming in the OpenXR Action Map editor. Sorry if this seems like a mashup of unrelated changes, but most of them do need of one another."
"117079","Soften duplicate signal registration error in JNISingleton","Fixes 116615. When two Android plugins both register a signal with the same name, the engine logs an error. This PR checks `ClassDB::has_signal` before calling `ADD_SIGNAL` and skips the duplicate registration with a warning instead of erroring out. Signals continue to work as expected as they emit and connect at the instance level, so each plugin's signal still works independently. The class-level registration is only for metadata/validation purposes afaik."
"117077","NavMesh implementations finding bad paths due to faulty neighbour node updates","Tested versions Found while using 4.6.stable, has existed for some time, relevant code has been moved around / refactored so didn't dig too far back. System information Linux, Godot V4.6.stable + master Issue description Hi. I was making a demo app for a devlog to demonstrate why a nav mesh was not going to be suitable for my project, and after bolting on a 2D visibility graph and adding a few procedurally generated 'maps' and code to visualise things, I noticed some rather odd detours being taken in nav-mesh paths. While this was kind of great for my purposes, it felt a little OTT; there seemed to be clearly better corridors it should have taken, using polygons that would surely have been expanded. I was looking at something like the following, but I'm not going to remove the things I've since added, so spoiler alert ;P The orange path is the current implementation (the green is drawn over the top of yellow and orange at start and end). <img width=""1474"" height=""1033"" alt=""Image"" src=""https://github.com/user-attachments/assets/4f78c45a-5a04-4816-9d89-71d2a1570174"" /> I believe the error is in updating previously visited nodes, specifically this line: modules/navigation_2d/2d/nav_mesh_queries_2d.cpp:299 `if (new_traveled_distance < neighbor_poly.traveled_distance) {` While this is perfectly normal looking for an A* implementation, it is making one very important assumption: that the heuristic does not change. In this not really A* we are doing that does not hold, with the poly position shifting depending on where we are coming from. The update condition needs to be made consistent with the priority queue. The 'tight' check with the !is_equal_approx() is required to avoid nodes constantly re-opening each other (inf loop), not common but if the geometry & start/end positions are just so... it happens; another consequence of the not really A* we are doing and the fact we have no concept of closed nodes here, and must always re-evaluate and potentially re-open previously visited nodes. How exactly the existing version checking only the travel_cost was avoiding this remains a mystery to me. Some more examples: <img width=""1212"" height=""701"" alt=""Image"" src=""https://github.com/user-attachments/assets/27f8504d-4910-43cd-8e61-1997f2bc1e99"" /> <img width=""1603"" height=""934"" alt=""Image"" src=""https://github.com/user-attachments/assets/c760250e-0b00-4ec5-a401-d758557bc14c"" /> <img width=""1274"" height=""807"" alt=""Image"" src=""https://github.com/user-attachments/assets/3a65a472-da19-4766-a9a3-89ceb3f14525"" /> These are mostly ones that are flattering to the fix of course. They often all find the same path (far less often on bigger meshes though), but that is a boring case to show; and the 'fixed' version sometimes finds a worse path, particularly on very small meshes (one included above, if I uploaded what I intended), but usually better or the same. To get a better/bigger picture, I collected stats from 10000 random pathing runs per map (and three seeds each for the procedural maps), I counted the number of times each achieved a 1st place (shortest path), 2nd, or 3rd (including ties for 1st and 2nd), and reported the percentage of times it achieved that 'rank', and then also the sum of all path distances and a percentage longer than optimal that is. The percentages of 1st and 3rd rankings are probably most interesting, and show the the fixed version generally performs better on all but the tiny toy map. Map1 is a tiny toy map, made in editor. Map2 is procedurally generated, 'buildings' roughly on a grid, fairly small Map3 extends Map2, offsets buildings from the grid a bit more and is much bigger Map4 is procedurally generated, maze-like, but not overly complicated, smallish Map5 is Map4 but bigger Map6 is large (area, not so much verts), editor made, intended to be an RTS like map This was all done in 2D, but the code for 3D is identical and will almost certainly have the same bug, I have not got to testing that yet. More testing with different maps/map-types would obviously be nice, but I've spent too long down this rabbit hole already and will be attending to other things for a while :-) I will get the demo project on github in the next day or two, it is obviously using a modified engine that can run the old code and the proposed fix at the same time. I will get a write up on what I did there and then drop an update here when both are done. Steps to reproduce Path on a (reasonably sized) mesh, observe odd detours from the ideal path. Modify code with proposed fix and try again :-) Minimal reproduction project (MRP) Hard to gauge what exactly is required for a minimal setup, but will be uploading demo soon (which is far from minimal, but is mostly visualisation and mesh generation code + a visibility graph in an extension)"
"117074","Fix RichTextLabel `[ol type=a]` not generating the right prefix","Previously BBCode with long ordered lists using letters picked a wrong prefix. Starting with the 24th item, it should pick prefix `x` and continue with `y`, `z` , `aa`, but it picked `` a` ``, `aa`, `ab`, `ac`. Example BBCode:"
"117070","Fix ""Could not resolve script"" error after renaming a preloaded script","Fixes 92007"
"117067","[Linux] Fix `addr2line` call","See: * https://github.com/godotengine/godot/pull/115566issuecomment-3999054139 <!-- Please target the `master` branch in priority. Relevant fixes are cherry-picked for stable branches as needed by maintainers. To speed up the contribution process and avoid CI errors, please set up pre-commit hooks locally: https://contributing.godotengine.org/en/latest/engine/introduction.htmlsetting-up-a-dev-environment -->"
"117066","Profiler: Fix for graph not displaying performance spikes at different zoom levels","Profiler: graph was not displaying performance spikes at different zoom levels. NOTE: BRAND NEW CODE AS OF 3/22/2026 While zooming in and out on the profiler graph the performance spikes would vanish. This was because the sampling method was skipping spike data as it picked data to display. The new method captures min and max over the entire sampling window so no high or low points are missed - no matter what the zoom scale is. Additionally before this fix the graph would flicker and jitter as the sample points were changing. Users have assumed something was broken with the graph and comment things like this in their bugs: ""instead the graph starts to flicker or something."" This is from 76146 *********** The old code would not draw the graph correctly. The new code does draw it correctly and has a touch better performance. Speed before code fix to display performance spikes correctly: _update_plot 100 runs total: 168466 usec, average: 1684 usec per call - graph is starting to fill up _update_plot 100 runs total: 357756 usec, average: 3577 usec per call _update_plot 100 runs total: 537164 usec, average: 5371 usec per call - graph is full from here on _update_plot 100 runs total: 566930 usec, average: 5669 usec per call _update_plot 100 runs total: 584532 usec, average: 5845 usec per call _update_plot 100 runs total: 586033 usec, average: 5860 usec per call _update_plot 100 runs total: 592993 usec, average: 5929 usec per call Speed after code fix to display performance spikes correctly: _update_plot 100 runs total: 167741 usec, average: 1677 usec per call - graph is starting to fill up _update_plot 100 runs total: 340753 usec, average: 3407 usec per call _update_plot 100 runs total: 488717 usec, average: 4887 usec per call - graph is full from here on _update_plot 100 runs total: 521295 usec, average: 5212 usec per call _update_plot 100 runs total: 519643 usec, average: 5196 usec per call _update_plot 100 runs total: 532377 usec, average: 5323 usec per call _update_plot 100 runs total: 546293 usec, average: 5462 usec per call *********** NOTE: BRAND NEW MOVIES AS OF 3/22/2026 before fix simple.webm after fix simple.webm Here are a before the fix video and an after the fix video. Both these video show the profiler just running - no zoom, no panning, no user input. You can see the frame count incrementing in the upper right corner so data is coming in and the graph is moving to the left as that new data comes in. In the before my code fix video the graph is very jittery and the performance spikes appear and disappear. In the after my code fix video the graph motion is smooth and the performance spikes do NOT disappear. I'd rate this as a high importance fix because the point of the profiler graph is to find the performance spikes. *********** All code changes are in 1 method only. The graph will now never hide performance issues from the user. ******************************* Disclosure and License -As a software engineer I use many systems to ensure code quality, and that includes AI. I use the AI to: do detailed code analysis, be a sounding board for my different ideas, look for bugs, find unexpected behaviors, identify performance hot spots, expensive CPU calls, race conditions, poorly placed variable initializations, possible optimizations, and many more things. I do this during development and before I push code to the repo. It lists items that are potential problems and I decide what I think is important and make those changes. -For a descriptive example of my AI usage on a particular PR please read this https://github.com/godotengine/godot/pull/117066issuecomment-4061773098 -Any and all code attached to this PR falls under the coverage of the MIT License."
"117064","Deadlock when quitting during pipeline compilation","Tested versions - Reproduciable in v4.6.1 System information Godot v4.6.1.stable.mono - Windows 11 (build 26200) - Multi-window, 3 monitors - Direct3D 12 (Forward+) - dedicated NVIDIA GeForce RTX 2070 SUPER (NVIDIA; 32.0.15.8180) - Intel(R) Core(TM) i9-14900K (32 threads) - 31.80 GiB memory Issue description When using the multi threaded rendering, `WorkerThreadPool` might deadlock, if you call `GetTree().Quit(1);` while it is compiling a shader pipeline. Order of events causing deadlock: 1. `GetTree().Quit(1);` is called. 2. Main thread enters `WorkerThreadPool::exit_languages_threads()`. 3. All threads enter/report back to `RUNLEVEL_PRE_EXIT_LANGUAGES`. 4. Worker thread 0 (RenderingServer Thread) starts new flush/draw (see call stack below). 5. Main thread moves forward and switches runlevel to `RUNLEVEL_EXIT_LANGUAGES` and enters the next loop to wait for all threads to detach from scripting language. 6. Worker thread 0 (RenderingServer Thread) enters `PipelineHashMapRD::compile_pipeline`, calls `WorkerThreadPool::add_template_task`, which in turn ends up in `WorkerThreadPool::_post_tasks`. It finally reaches the `while (runlevel == RUNLEVEL_EXIT_LANGUAGES)` loop. 7. Now the main thread is indefinetly waiting for the remaining thread to exit, while the remaining worker thread 0 is indefinetly waiting for the runlevel to change. It appears the underlying issue is, that the rendering thread is still able to post a new task while run level is already at `RUNLEVEL_PRE_EXIT_LANGUAGES` or `RUNLEVEL_EXIT_LANGUAGES`. Call stack of Main thread: Call stack of Worker thread 0 (RenderServer thread): Steps to reproduce 1. Enable multi threaded rendering. 2. `GetTree().Quit(1);` right in the first frame 3. Have enough nodes in the scene to get the timing right 🫠 Minimal reproduction project (MRP) Here's a repro project. To enforce the bug you have to change the engine by adding a `OS::get_singleton()->delay_usec(500'000);` at this line worker_thread_pool.cppL851 deadlock-bug.zip"
"117063","Draw_line() and draw_polyline not draw consistent line when use negative line width","Godot 4.6 <img width=""53"" height=""63"" alt=""Image"" src=""https://github.com/user-attachments/assets/02baae69-cde5-4b4f-8e24-7108a5baa924"" /> When use -1 as line_width on custom draw line & polyline & multiline, it not always draw same line width like in godot 3. Seem like the line is draw between 2 pixels so it draw both of them, then the width become 2. <img width=""196"" height=""106"" alt=""Image"" src=""https://github.com/user-attachments/assets/92d21bfa-70ce-459c-bb0f-298b8dc66b87"" /> Issue may relation to this System information windows 10 Issue description Draw_line with -1 width will draw thicker line sometime. Steps to reproduce Draw some line and polyline with -1 width, zoom in or out the camera. Minimal reproduction project (MRP) DrawTest.zip"
"117061","Unexpected translation issues at the animationTree lower panel","Tested versions Reproducible in latest (4.6.1) and maybe almost all versions with english to spanish (and others maybe) translation integrated into the engine System information Windows 11 - Godot 4.6.1 Issue description I was working with the Animation Tree Node (used tree root: AnimationNodeBlendTree -Not sure if repeated in other roots-) on 3d, and when i designated the parameters for a Transition the engine translated Run and Idle from the inspector to ""Ejecutar"" and ""Inactivo"" in the AnimationTree lower panel of godot engine <img width=""550"" height=""583"" alt=""Image"" src=""https://github.com/user-attachments/assets/16dcd5f3-0b8e-47b6-bfda-4387d3964ce9"" /> Note: My current system is running in Spanish so maybe it is an unexpected issue in the system that translates the UI of godot to the selected lenguage of the system Steps to reproduce 1: Create an AnimationTree node on a 3d scene 2: Create a transition node in the AnimationTree 3: Set up parameters in english with the words Run or Idle by parameter (Capital sensitive) Result: Expected system lenguage translation in the lower panel of the AnimationTree (ONLY IF GODOT LENGUAGE IS NOT SET ON ENGLISH) Minimal reproduction project (MRP) AnimationTreeBug.zip"
"117060","[Linux] Improve crash trace symbols","This changes things from: To: The exact format depends on the specific `addr2line` implementation, above is with the standard `addr2line`, below is with llvm and gimli respectively Includes: * https://github.com/godotengine/godot/pull/117067 <!-- Please target the `master` branch in priority. Relevant fixes are cherry-picked for stable branches as needed by maintainers. To speed up the contribution process and avoid CI errors, please set up pre-commit hooks locally: https://contributing.godotengine.org/en/latest/engine/introduction.htmlsetting-up-a-dev-environment -->"
