"id","title","description","body","ground_truth_id"
"200021","`Camera2D.position_smoothing_speed`: correct description and fix overshoot bug","In `Camera2D`, the property `position_smoothing_speed` has the following description: > Speed in pixels per second of the camera's smoothing effect if [member position_smoothing_enabled] is [code]true[/code].","In `Camera2D`, the property `position_smoothing_speed` has the following description: > Speed in pixels per second of the camera's smoothing effect if [member position_smoothing_enabled] is [code]true[/code]. This fixes the overshoot bug in a compatible manner. This is easy to trigger by `position_smoothing_speed` to a value higher than the max fps but it can also happen with reasonable values if time delta becomes high enough. If delta increases to 1/60 then the camera moves all the way to the target position, as if with no smoothing. It determines what proportion (not pixels) of the distance between the smoothed_position and the target_position the camera will cover every tick (process or physics depending on configuration). Any consistent drops in framerate that result in a lerping factor above 2 will completely break smoothing since the camera will overshoot more and more each frame as can be observed here: https://github.com/user-attachments/assets/c3112b61-c1b6-412a-88e0-fd3b5ee3e67c **What this PR does** This PR corrects the description of `position_smoothing_speed` to give users a more accurate intuition on what different values do and fixes the overshoot by clamping the calculated lerp factor to 1. That means the camera actually overshoots across the target position and ends at the same distance it was before, causing a constant oscillation. If the framerate drops to 30 a delta of 1/30 will result in a lerping factor of 2. Besides the incorrect description, the approach can cause different behavior, even big glitches depending on framerate: Any time `position_smoothing_speed * delta` ends up being higher than 1.0 we are extrapolating rather than interpolating. A more correct solution would be to use frame-independent interpolation such as exponential decay, as explained here: https://docs.godotengine.org/en/stable/tutorials/math/interpolation.htmlsmoothing-motion (see Note) So far so good. For example, if the camera is set to change on process, and `position_smoothing_speed` is set to 60 then when delta is 1/120 the lerping factor is 0.5 so the camera moves half way to the target position each frame. This doesn't really make sense if we look at the observed behavior and looking at the code we can confirm it's indeed not a velocity at all. From Camera2D::get_camera_transform(): As you can see what we're doing is a simple lerp: `smoothed_pos = lerp(smoothed_pos, target_pos, position_smoothing_speed * delta)` So `position_smoothing_speed` is not in px/s but 1/s and does not determine speed or acceleration, it's just part of a ratio calculation.","117637"
"200022","Problem noted: add standard macOS/Windows menu key bindings to the default input map. Handle menu action in some editor controls.","Adds standard platform specific menu key combinations to the input map: - `Ctrl + Enter` on macOS.","Adds standard platform specific menu key combinations to the input map: - `Ctrl + Enter` on macOS. - `Shift + F10` on Windows. Adds `ui_menu` handling to editor GUI elements not present it (note, some uses of context menus are position specific, and can't be directly handled by the key event): - [x] Editor inspector. - [ ] TODO Partially fixes https://github.com/godotengine/godot/issues/117593","117614"
"200023","Skeleton2D nodes with a non-empty modification_stack cannot be instantiated multiple times in the same scene","Problem noted: problem noted: tested versions v4.6.1.stable.mono.official.14d19694e System information Winwos11 - Godot v4.6.1.stable.mono.official.14d19694e - Vulkan 1.4.312 (Forward+) - NVIDIA GeForce RTX 3060 Laptop GPU bug description When a scene containing a Skeleton2D child node, whos...","Problem noted: tested versions v4.6.1.stable.mono.official.14d19694e System information Winwos11 - Godot v4.6.1.stable.mono.official.14d19694e - Vulkan 1.4.312 (Forward+) - NVIDIA GeForce RTX 3060 Laptop GPU bug description When a scene containing a Skeleton2D child node, whose Skeleton2D node's modification_stack property is not empty, is instantiated multiple times in other scenes, a large number of duplicate error messages will be output, all stating ""ERROR: Drawing is only allowed inside this node's _draw(), functions connected to its draw signal, or when it receives NOTIFICATION_DRAW."" At this time, the editor becomes abnormally laggy, the 2D skeletal animation exhibits many anomalies, and sometimes the editor even crashes directly and becomes unresponsive. Steps to reproduce 1. **Reproduce the issue** - Run the test scene - Observe the console output - The following error will spam repeatedly: - The editor will become extremely laggy - 2D skeletal animations will display abnormally - In severe cases, the editor may crash or become unresponsive 4. **Actual behavior:** - Multiple instances of the same scene cause continuous error spam - Editor performance degrades significantly - Skeletal animations fail to render correctly - Editor may crash when multiple instances are active - Setting `resource_local_to_scene = true` on the SkeletonModificationStack2D resource resolves the issue Minimal reproduction project (MRP) Test4.6.zip **Expected behavior:** - No error messages - Smooth editor performance - Normal skeletal animation display 5. **Create a test scene** - Create a new scene with a Node2D as root - Instance `skeleton_scene.tscn` multiple times (at least 2-3 instances) as children 3. <img width=""2559"" height=""1522"" alt=""Image"" src=""https://github.com/user-attachments/assets/ea002a21-5468-4817-b41f-df799c47015b"" /> But if you set the `resource_local_to_scene` property of the SkeletonModificationStack2D resource to true, this problem will not occur. **Create a Skeleton2D scene** - Create a new scene with a Node2D as root - Add a Skeleton2D node as child - Add a SkeletonModificationStack2D resource to the Skeleton2D node's `modification_stack` property - Add at least one modification (e.g., SkeletonModification2DLookAt) - Save this scene as `skeleton_scene.tscn` 2.","117090"
"200024","RichTextLabel Image width percentage not implemented as in reference","Tested versions Tested and reproduced in Godot 4.6, 4.6.1, 4.5.1 and 4.7 dev1.","Tested versions Tested and reproduced in Godot 4.6, 4.6.1, 4.5.1 and 4.7 dev1. System information Fedora - Godot 4.6 - Compatability defect description Flagged as a bug report instead of feature suggestion, as while I don't believe it is a regression, or a classic bug, the behavior is different from the description of the bbcode implementation in the docs. When specifying the width of an image in bbcode with `[img=100%]{path}[/img]`, the number gets interpreted as pixel,s instead of the expected behavior as percentage of label width. Behavior of `[img width=100%]{path}[/img]` is correct. <img width=""1920"" height=""1048"" alt=""Screenshot of property not working for implicit width, but working when specified as an option"" src=""https://github.com/user-attachments/assets/f2e18c2f-7286-40b8-a0a2-441364e8a64f"" /> Steps to reproduce New Project -> Add Image (example) to project -> Add Control Node and RichTextLabel as a child -> make it take up the entire screen -> Enable `bbcode_enables` -> Add the following text: Minimal reproduction project (MRP) MRP-bbcode.zip","116927"
"200025","`Texture2D.draw_rect` rendering at low resolution and with dark outline on HiDPI displays","Issue observed: issue observed: bug report: tested versions - Reproducible in v4.7.dev [2af785641ae249573f45eb61852d22e0b1a8a03c] - Reproducible in v4.6.1.stable.official [14d19694e] System information Godot v4.7.dev (a761ad537) - macOS Tahoe (26.3.1) - Multi-window, 2 monitors - OpenGL 3 (Co...","Issue observed: bug report: tested versions - Reproducible in v4.7.dev [2af785641ae249573f45eb61852d22e0b1a8a03c] - Reproducible in v4.6.1.stable.official [14d19694e] System information Godot v4.7.dev (a761ad537) - macOS Tahoe (26.3.1) - Multi-window, 2 monitors - OpenGL 3 (Compatibility) - Apple M4 Pro - Apple M4 Pro (14 threads) - 24.00 GiB memory Issue description Attempting to draw an SVG texture on a HiDPI display using the `Texture2D.draw_rect()` method gives a blurry result. Here is an example from my code actions PR: <img width=""293"" height=""106"" alt=""Image"" src=""https://github.com/user-attachments/assets/f44bec65-273d-4746-855a-4a48d736e83a"" /> In addition, when the editor is in light mode, there is some strange gray outline around the icon (perhaps due to some antialiasing technique?): <img width=""314"" height=""108"" alt=""Image"" src=""https://github.com/user-attachments/assets/955e2542-2bd2-47e7-8ffe-bf302f67d7dc"" /> Both of these are the result of the following C++ code: with `p_canvas_item` being the output of `TextEdit.get_text_canvas_item()` and `use_color` being the yellow color of the icon. Steps to reproduce Attempt to call the `Texture2D.draw_rect()` method with a small SVG icon on a HiDPI screen. The icon will appear blurry/pixellated. If drawn on a light background, dark artifacts will be visible around the icon. Minimal reporduction project (MRP) The call to `draw_rect()` in my code actions PR is here: https://github.com/Meorge/godot/blob/a761ad5374bc4cf0559039b417be3f25669bfbcb/scene/gui/code_edit.cppL490 I've also attempted to create an MRP using pure GDScript. It renders the same lightbulb icon using several different methods. In the `draw_rect()` method (and related methods), the same resolution and artifact issues can be seen: mrp-draw-texture_2026-03-29_21-02-45.zip","117988"
"200026","Script editor doesn't focsu with ctrl + f3 on script workspace","Bug report: bug report: tested versions Reproducible in: v4.6.1.stable.official [14d19694e] v4.7.dev1.official [bf95b6258] System information Godot v4.6.1.stable - Windows 11 (build 26100) - Multi-window, 1 monitor - OpenGL 3 (Compatibility) - GeForce GTX 550 Ti - Intel(R) Core(TM) i3-210...","Bug report: tested versions Reproducible in: v4.6.1.stable.official [14d19694e] v4.7.dev1.official [bf95b6258] System information Godot v4.6.1.stable - Windows 11 (build 26100) - Multi-window, 1 monitor - OpenGL 3 (Compatibility) - GeForce GTX 550 Ti - Intel(R) Core(TM) i3-2100 CPU @ 3.10GHz (4 threads) - 11.95 GiB memory Issue description `ctrl + f3` doesn't focus the script editor when the script workspace is active, but another dock is focused, ex: FileSystem (alt + f). Workaround: - switch to the 2d workspace (ctrl + f1) - switch to the script workspace (ctrl + f3) Minimal reproduction project (MRP) N/A The current workaround is to switch to another workspace then back to the script workspace: - 2d (ctrl + f1) - script (ctrl + f3) Steps to reproduce - switch to the script workspace (ctrl + f3) - open an existing file or create a new file - see the cursor blinking in the script editor - focus another dock, ex: the filesystem (alt + f) or the scene dock, (shift + ctrl + p, type: scene dock, press: enter) - try to focus the script editor (ctrl + f3, or shift + ctrl + p, type: script editor, press: enter) - issue, the script editor doesn't become focused, the previous dock remains focused Expected: Focus the script editor with (ctrl + f3, and shift + ctrl + p, type: script editor, press: enter), on the script workspace, when another dock is focused.","116989"
"200027","resolve signal button disable on script edit","Fixes 117623 where editing a script file would cause the ""Connect..."" button to become disabled.","Fixes 117623 where editing a script file would cause the ""Connect..."" button to become disabled. <!-- Please target the `master` branch. This change checks for selection in connections dock tree to see if connect button can be enabled or disabled. We will take care of backporting relevant fixes to older versions. Before submitting, please read our checklist for new contributors: https://contributing.godotengine.org/en/latest/engine/introduction.htmlchecklist-for-new-contributors -->","117664"
"200028","macOS: Crash of embedded game also crasehd the editor","Tested versions - Reproducible in: Custom fork of 4.6.stable, with a few modifications System information MacBook Pro M1 Max, macOS 15.5 bug description This defect description will be a bit vague, as I am not able to reproduce this myself, but it seems likely there is (or was?...","Tested versions - Reproducible in: Custom fork of 4.6.stable, with a few modifications System information MacBook Pro M1 Max, macOS 15.5 bug description This issue description will be a bit vague, as I am not able to reproduce this myself, but it seems likely there is (or was?) some issue with the game embedding on macOS, as we had this editor crash reported to us, which happened right as the embedded game itself crashed: Note that this is from a custom fork of 4.6-stable with a few changes here and there, so the line numbers might not perfectly match `master`, but as far as I know none of the more relevant classes here have had any changes done to them. Judging by the call stack and the `KERN_INVALID_ADDRESS at 0x00000000000009d0`, it looks like it's crashing here in `LayerHost::gui_input`, due to `script_debugger` being `nullptr`: https://github.com/godotengine/godot/blob/15a4311583fbaad2eee5d2ecda5437eb9fd68c63/platform/macos/editor/embedded_process_macos.mmL348-L352 My best guess is that `EmbeddedProcessMacOS::set_script_debugger` was called with `nullptr` from `GameView::_detach_script_debugger` after the game process crashed, and at the next flushing of input events it ends up erroneously making its way to this `send_message` call in `LayerHost::gui_input`, but I've tried to simulate this by pushing input events every frame (in both a game and tool context) and manually killing the game process, but it seems to handle it gracefully every time. Minimal reproduction project (MRP) None yet, unfortunately. Steps to reproduce None yet, unfortunately.","116721"
"200029","Editor: resolve display of objects in the Remote Inspector","* Fixes 116820.","* Fixes 116820. Test scrip:t","116847"
"200030","Crash with obscure error messages when adding non-ascii charactres to Compatibility scene shader","Tested versions 4.7.dev System information GLES3, Direct3D12, Windows Issue description Before anything else, I would like to mention that the process of writing and debugging scene shaders is really not great, and the rendering team would greatly benefit from better tools (Be...","Tested versions 4.7.dev System information GLES3, Direct3D12, Windows Issue description Before anything else, I would like to mention that the process of writing and debugging scene shaders is really not great, and the rendering team would greatly benefit from better tools (Better error messages, a setting for recompiling shaders at engine startup rather than engine build time, rudimentary compile errors within the IDE). Now to the issue: When you write any non-ascii character in GLSL shader for compatibility (`drivers\gles3\shaders\scene.glsl`), you get an infuriatingly unhelpful compilation error message: `error C0000: syntax error, unexpected $end at token ""<EOF>""` This even happens when the respective character is part of a comment, which does not help when you try to fix the error by commenting out lines (happened to me when I was trying to refer to an algorithm by somebody named Ureña, and I swear, I wasted hours on this). If you run the engine from the console, you get slightly more helpful errors: `Unicode parsing error, some characters were replaced with � (U+FFFD): Invalid unicode codepoint (ffffffb1), cannot represent as UTF-8`, but it still does not say the line, the file, the particular character (ffffffb1 means nothing), or that the characters should all be ASCII, rather than UTF-8. Potentially related: https://github.com/godotengine/godot/issues/61756 Steps to reproduce Add this comment to `drivers\gles3\shaders\scene.glsl`: `// ñ` recompile and run in compatibility rendering mode. Minimal reproduction project (RMP) N/A","116753"
"200031","Problem noted: fix tree `ui_down` error","Problem noted: resolve 116233.","Problem noted: resolve 116233.","116252"
"200032","hang in AnimatedSprite2D","Problem noted: tested versions Godot 4.7 dev2 System information Windows 10, i5, GTX 2060 problem description When pressing ""Add frame from File"" Godot crashde.","Tested versions Godot 4.7 dev2 System information Windows 10, i5, GTX 2060 problem description When pressing ""Add frame from File"" Godot crashde. Maybe not saving is a step to reproduce? <img width=""1132"" height=""594"" alt=""Image"" src=""https://github.com/user-attachments/assets/50ff89a9-11ff-4269-95b4-12c3b4c8b0d4"" /> Steps to reproduce I couldn't repeat the crash Minimal reproduction project (MRP) N/A It only happened once. I didn't save before pressing.","117230"
"200033","Fix timeline cursor following mouse during marker selection","Bug report: issue observed: when right-clicking an existing marker and then left-clicking an empty space on the timeline, and click another place on the timeline, the timeline cursor follow mouse without holding mouse.","Issue observed: when right-clicking an existing marker and then left-clicking an empty space on the timeline, and click another place on the timeline, the timeline cursor follow mouse without holding mouse. Reproducible in: 4.6.1.stable Not reproducible in: 4.5.1.stable Before fix: https://github.com/user-attachments/assets/2fe84dc3-50f4-420c-93a4-a0d5289d6aec After fix: https://github.com/user-attachments/assets/baaa50f1-8ebf-442e-a86b-8de184f25f29 Similar to 117276, The bug is reproducible in 4.6.1.stable while not reproducible in 4.5.1.stable. The bug was introduced in commit 2a10291. I confirmed that 2a10291~1 doesn't have this problem. The cause of the bug is that `moving_selection_attempt` is set as true in `_try_select_at_ui_pos`, and `AnimationMarkerEdit` accept the mouse releasing event when `moving_selection_attempt` is true, so the timeline doesn't know left-mouse has been released. To solve this problem we can add a `moving_selection_attempt = false`. MRP mrp-timecursor-follow-jump.zip <!-- Please target the `amster` branch. We will take care of backporting relevant fixes to older versions. Beofre submitting, please read our checklist for new contributors: https://contributing.godotengine.org/en/latest/engine/introduction.htmlchecklist-for-new-contributors -->","117634"
"200034","Problem noted: editor: Fix Bone2D creation to form proper bone chains from selected Node2D hierarchies","during using ""Make Custom Bone2D(s) from Node(s)"" with a selection that includes both a parent and its child Node2D, the resulting Bone2D nodes were previously inserted at the same level in the scene tree — the parent/child relationship between the original nodes was not refle...","during using ""Make Custom Bone2D(s) from Node(s)"" with a selection that includes both a parent and its child Node2D, the resulting Bone2D nodes were previously inserted at the same level in the scene tree — the parent/child relationship between the original nodes was not reflected in the bone hierarchy at all. - Tracking a node→bone mapping so that each new Bone2D is reparented under the Bone2D created for its NodeD2's parent (when that parent was also selected), producing a proper bone chain rather than a flat list. - All `_set_owner_for_node_and_children` undo calls are deferred to after the structural undo operations (remove/add child) for all nodes have been registered. - Depths are precomputed into a HashMap before sorting, reducing the sort from O(n·d·log n) to O(n·d + n·log n) by avoiding repeated ancestor traversals per comparison. - An early return is added when the selection contains no Node2D instances (e.g. This commit fixes that by: - Sorting selected nodes by depth (shallowest first) before processing, so a parent's bone is always created before its child's bone. This prevents the recursive ownership walk from descending into intermediate Bone2D nodes that are still attached to the tree mid-undo in scenes with non-selected nodes between two selected ancestors. only Control nodes), preventing an empty no-op undo action from being pushed onto the stack. Several correctness issues in the undo/redo logic are also fixed: - A `memdelete` was added for the allocated Bone2D when the node has no parent, fixing a pre-existing memory leak. - The original transform is now captured into a local variable before the Bone2D is constructed, making the intent of the undo transform restore explicit rather than relying on `new_bone->get_transform()` being equal to the captured value.","117185"
"200035","Add undo/redo to adding/removing StateMachine nodes","Closes 9165.0","Closes 9165.0","116946"
"200036","Problem noted: [Arch Linux/Wayland] Vulkan Swap Chain Error causing intermittent stuttering/lag","Bug report: tested versions -4.6.1 stable latest master -4.7.dev System information godot ver 4.7.dev Linuxbsd on Arch Linux x86_64, kernel 6.19.8-arch1-1, niri 25.11 wm (Wayland), Intel i7-9700K CPU, NVIDIA GTX 1070 GPU problem description Have been seeing variations of the f...","Bug report: tested versions -4.6.1 stable latest master -4.7.dev System information godot ver 4.7.dev Linuxbsd on Arch Linux x86_64, kernel 6.19.8-arch1-1, niri 25.11 wm (Wayland), Intel i7-9700K CPU, NVIDIA GTX 1070 GPU problem description Have been seeing variations of the following across multiple versions from godot 4.6.1 stable to now the latest master which I compiled locally as v4.7.dev.custom_build.1eb0374e5: `ERROR: Condition ""err != VK_SUCCESS"" is true. Returning: false at: _determine_swap_chain_format (drivers/vulkan/rendering_device_driver_vulkan.cpp:3444) ERROR: Surface did not return any valid formats. at: swap_chain_resize (drivers/vulkan/rendering_device_driver_vulkan.cpp:3705) ERROR: Condition ""err != VK_SUCCESS"" is true. Returning: false` Error was encountered in both forward+ and mobile rendering profiles. Did not seem to occur in compatibility mode. I have also experienced some random crashes which seem related via timing but mostly I've just encountered large frame lag associated with the error message. Occurs intermittently while in the editor or while running. I am in single window mode as I cannot seem to get the game to embed in the editor window even with all the settings checked. I suspect that may be because of my window manager (niri) but unclear. Here is a full log of a single short session launched via my terminal. All I did was fly around in the editor scene view and move the camera a few times: Steps to reproduce Just run the engine with a basic 3d scene with a cube mesh, camera and light. Move the camera or the cube. Minimal reproduction project (MRP) swapchain-error-testproj.zip","117519"
